python/tune_log_file/mobilenet-NCHW-B1-opencl-C2800-T21-08-12-21-31.json
{"i": [["[\"9847f8cc0b305137f49f2c5c0c8ab25d\", 1, 1280, 1000, 1280, 1000, 1, 1000]", "opencl -keys=opencl,gpu -max_num_threads=256 -thread_warp_size=1", [2, 16, 64, 4096, 4096000, 512, 2, 8], "llvm -keys=cpu -link-params=0 -mtriple=aarch64-linux-gnu", 0, []], [[], [["SP", 2, 0, 1, [1, 1, 1, 1], 1], ["SP", 2, 5, 1000, [1, 20, 1, 1], 1], ["SP", 2, 10, 1280, [1, 8], 1], ["RE", 2, [0, 5, 1, 6, 2, 7, 10, 11, 3, 8, 12, 4, 9]], ["FSP", 4, 0, 0, 3], ["FSP", 4, 4, 1, 3], ["RE", 4, [0, 4, 1, 5, 2, 6, 3, 7]], ["CA", 2, 4, 5], ["CHR", 1, "shared", [2]], ["CA", 2, 3, 6], ["CHR", 0, "shared", [3]], ["CA", 1, 4, 6], ["FU", 6, [0, 1]], ["AN", 6, 0, 5], ["FU", 6, [1, 2]], ["AN", 6, 1, 4], ["FU", 6, [2, 3]], ["AN", 6, 2, 6], ["FU", 3, [0, 1]], ["SP", 3, 0, 8, [1], 1], ["AN", 3, 1, 2], ["FFSP", 3, 0, [1, 0], 1, 1], ["AN", 3, 1, 6], ["FU", 1, [0, 1]], ["SP", 1, 0, 8, [4], 1], ["AN", 1, 1, 2], ["FFSP", 1, 0, [1, 0], 1, 1], ["AN", 1, 1, 6], ["PR", 4, 0, "auto_unroll_max_step$512"]]]], "r": [[0.00364134, 0.0037111, 0.00388638], 0, 29.4382, 1628775139], "v": "v0.6"}
{"i": [["[\"9847f8cc0b305137f49f2c5c0c8ab25d\", 1, 1280, 1000, 1280, 1000, 1, 1000]", "opencl -keys=opencl,gpu -max_num_threads=256 -thread_warp_size=1", [2, 16, 64, 4096, 4096000, 512, 2, 8], "llvm -keys=cpu -link-params=0 -mtriple=aarch64-linux-gnu", 0, []], [[], [["SP", 2, 0, 1, [1, 1, 1, 1], 1], ["SP", 2, 5, 1000, [1, 10, 1, 2], 1], ["SP", 2, 10, 1280, [8, 5], 1], ["RE", 2, [0, 5, 1, 6, 2, 7, 10, 11, 3, 8, 12, 4, 9]], ["FSP", 4, 0, 0, 3], ["FSP", 4, 4, 1, 3], ["RE", 4, [0, 4, 1, 5, 2, 6, 3, 7]], ["CA", 2, 4, 5], ["CHR", 1, "shared", [2]], ["CA", 2, 3, 6], ["CHR", 0, "shared", [3]], ["CA", 1, 4, 6], ["FU", 6, [0, 1]], ["AN", 6, 0, 5], ["FU", 6, [1, 2]], ["AN", 6, 1, 4], ["FU", 6, [2, 3]], ["AN", 6, 2, 6], ["FU", 3, [0, 1]], ["SP", 3, 0, 80, [1], 1], ["AN", 3, 1, 2], ["FFSP", 3, 0, [1, 0], 1, 1], ["AN", 3, 1, 6], ["FU", 1, [0, 1]], ["SP", 1, 0, 40, [1], 1], ["AN", 1, 1, 2], ["FFSP", 1, 0, [1, 0], 1, 1], ["AN", 1, 1, 6], ["PR", 4, 0, "auto_unroll_max_step$0"]]]], "r": [[0.0534728, 0.0534282, 0.0544011], 0, 10.4452, 1628775144], "v": "v0.6"}
{"i": [["[\"9847f8cc0b305137f49f2c5c0c8ab25d\", 1, 1280, 1000, 1280, 1000, 1, 1000]", "opencl -keys=opencl,gpu -max_num_threads=256 -thread_warp_size=1", [2, 16, 64, 4096, 4096000, 512, 2, 8], "llvm -keys=cpu -link-params=0 -mtriple=aarch64-linux-gnu", 0, []], [[], [["SP", 2, 0, 1, [1, 1, 1, 1], 1], ["SP", 2, 5, 1000, [1, 20, 1, 1], 1], ["SP", 2, 10, 1280, [5, 1], 1], ["RE", 2, [0, 5, 1, 6, 2, 7, 10, 11, 3, 8, 12, 4, 9]], ["FSP", 4, 0, 0, 3], ["FSP", 4, 4, 1, 3], ["RE", 4, [0, 4, 1, 5, 2, 6, 3, 7]], ["CA", 2, 4, 5], ["CHR", 1, "shared", [2]], ["CA", 2, 3, 6], ["CHR", 0, "shared", [3]], ["CA", 1, 4, 6], ["FU", 6, [0, 1]], ["AN", 6, 0, 5], ["FU", 6, [1, 2]], ["AN", 6, 1, 4], ["FU", 6, [2, 3]], ["AN", 6, 2, 6], ["FU", 3, [0, 1]], ["SP", 3, 0, 5, [1], 1], ["AN", 3, 1, 2], ["FFSP", 3, 0, [1, 0], 1, 1], ["AN", 3, 1, 6], ["FU", 1, [0, 1]], ["SP", 1, 0, 1, [1], 1], ["AN", 1, 1, 2], ["FFSP", 1, 0, [1, 0], 1, 1], ["AN", 1, 1, 6], ["PR", 4, 0, "auto_unroll_max_step$512"]]]], "r": [[0.0276869, 0.0277315, 0.0285985], 0, 9.63206, 1628775148], "v": "v0.6"}
{"i": [["[\"9847f8cc0b305137f49f2c5c0c8ab25d\", 1, 1280, 1000, 1280, 1000, 1, 1000]", "opencl -keys=opencl,gpu -max_num_threads=256 -thread_warp_size=1", [2, 16, 64, 4096, 4096000, 512, 2, 8], "llvm -keys=cpu -link-params=0 -mtriple=aarch64-linux-gnu", 0, []], [[], [["SP", 2, 0, 1, [1, 1, 1, 1], 1], ["SP", 2, 5, 1000, [1, 100, 2, 1], 1], ["SP", 2, 10, 1280, [2, 1], 1], ["RE", 2, [0, 5, 1, 6, 2, 7, 10, 11, 3, 8, 12, 4, 9]], ["FSP", 4, 0, 0, 3], ["FSP", 4, 4, 1, 3], ["RE", 4, [0, 4, 1, 5, 2, 6, 3, 7]], ["CA", 2, 4, 5], ["CHR", 1, "shared", [2]], ["CA", 2, 3, 6], ["CHR", 0, "shared", [3]], ["CA", 1, 4, 6], ["FU", 6, [0, 1]], ["AN", 6, 0, 5], ["FU", 6, [1, 2]], ["AN", 6, 1, 4], ["FU", 6, [2, 3]], ["AN", 6, 2, 6], ["FU", 3, [0, 1]], ["SP", 3, 0, 4, [2], 1], ["AN", 3, 1, 2], ["FFSP", 3, 0, [1, 0], 1, 1], ["AN", 3, 1, 6], ["FU", 1, [0, 1]], ["SP", 1, 0, 2, [1], 1], ["AN", 1, 1, 2], ["FFSP", 1, 0, [1, 0], 1, 1], ["AN", 1, 1, 6], ["PR", 4, 0, "auto_unroll_max_step$1024"]]]], "r": [[0.0279236, 0.0298194, 0.0297745], 0, 6.29569, 1628775153], "v": "v0.6"}
{"i": [["[\"9847f8cc0b305137f49f2c5c0c8ab25d\", 1, 1280, 1000, 1280, 1000, 1, 1000]", "opencl -keys=opencl,gpu -max_num_threads=256 -thread_warp_size=1", [2, 16, 64, 4096, 4096000, 512, 2, 8], "llvm -keys=cpu -link-params=0 -mtriple=aarch64-linux-gnu", 0, []], [[], [["SP", 2, 0, 1, [1, 1, 1, 1], 1], ["SP", 2, 5, 1000, [2, 125, 1, 1], 1], ["SP", 2, 10, 1280, [1, 1], 1], ["RE", 2, [0, 5, 1, 6, 2, 7, 10, 11, 3, 8, 12, 4, 9]], ["FSP", 4, 0, 0, 3], ["FSP", 4, 4, 1, 3], ["RE", 4, [0, 4, 1, 5, 2, 6, 3, 7]], ["CA", 2, 4, 5], ["CHR", 1, "shared", [2]], ["CA", 2, 3, 6], ["CHR", 0, "shared", [3]], ["CA", 1, 4, 6], ["FU", 6, [0, 1]], ["AN", 6, 0, 5], ["FU", 6, [1, 2]], ["AN", 6, 1, 4], ["FU", 6, [2, 3]], ["AN", 6, 2, 6], ["FU", 3, [0, 1]], ["SP", 3, 0, 2, [2], 1], ["AN", 3, 1, 2], ["FFSP", 3, 0, [1, 0], 1, 1], ["AN", 3, 1, 6], ["FU", 1, [0, 1]], ["SP", 1, 0, 2, [1], 1], ["AN", 1, 1, 2], ["FFSP", 1, 0, [1, 0], 1, 1], ["AN", 1, 1, 6], ["PR", 4, 0, "auto_unroll_max_step$512"]]]], "r": [[0.0335248, 0.0169747, 0.0174088], 0, 7.06391, 1628775159], "v": "v0.6"}
{"i": [["[\"9847f8cc0b305137f49f2c5c0c8ab25d\", 1, 1280, 1000, 1280, 1000, 1, 1000]", "opencl -keys=opencl,gpu -max_num_threads=256 -thread_warp_size=1", [2, 16, 64, 4096, 4096000, 512, 2, 8], "llvm -keys=cpu -link-params=0 -mtriple=aarch64-linux-gnu", 0, []], [[], [["SP", 2, 0, 1, [1, 1, 1, 1], 1], ["SP", 2, 5, 1000, [1, 5, 2, 25], 1], ["SP", 2, 10, 1280, [4, 1], 1], ["RE", 2, [0, 5, 1, 6, 2, 7, 10, 11, 3, 8, 12, 4, 9]], ["FSP", 4, 0, 0, 3], ["FSP", 4, 4, 1, 3], ["RE", 4, [0, 4, 1, 5, 2, 6, 3, 7]], ["CA", 2, 4, 5], ["CHR", 1, "shared", [2]], ["CA", 2, 3, 6], ["CHR", 0, "shared", [3]], ["CA", 1, 4, 6], ["FU", 6, [0, 1]], ["AN", 6, 0, 5], ["FU", 6, [1, 2]], ["AN", 6, 1, 4], ["FU", 6, [2, 3]], ["AN", 6, 2, 6], ["FU", 3, [0, 1]], ["SP", 3, 0, 40, [1], 1], ["AN", 3, 1, 2], ["FFSP", 3, 0, [1, 0], 1, 1], ["AN", 3, 1, 6], ["FU", 1, [0, 1]], ["SP", 1, 0, 4, [2], 1], ["AN", 1, 1, 2], ["FFSP", 1, 0, [1, 0], 1, 1], ["AN", 1, 1, 6], ["PR", 4, 0, "auto_unroll_max_step$512"]]]], "r": [[0.0255098, 0.0255115, 0.0254137], 0, 9.67342, 1628775167], "v": "v0.6"}
{"i": [["[\"9847f8cc0b305137f49f2c5c0c8ab25d\", 1, 1280, 1000, 1280, 1000, 1, 1000]", "opencl -keys=opencl,gpu -max_num_threads=256 -thread_warp_size=1", [2, 16, 64, 4096, 4096000, 512, 2, 8], "llvm -keys=cpu -link-params=0 -mtriple=aarch64-linux-gnu", 0, []], [[], [["SP", 2, 0, 1, [1, 1, 1, 1], 1], ["SP", 2, 5, 1000, [5, 5, 2, 1], 1], ["SP", 2, 10, 1280, [4, 5], 1], ["RE", 2, [0, 5, 1, 6, 2, 7, 10, 11, 3, 8, 12, 4, 9]], ["FSP", 4, 0, 0, 3], ["FSP", 4, 4, 1, 3], ["RE", 4, [0, 4, 1, 5, 2, 6, 3, 7]], ["CA", 2, 4, 5], ["CHR", 1, "shared", [2]], ["CA", 2, 3, 6], ["CHR", 0, "shared", [3]], ["CA", 1, 4, 6], ["FU", 6, [0, 1]], ["AN", 6, 0, 5], ["FU", 6, [1, 2]], ["AN", 6, 1, 4], ["FU", 6, [2, 3]], ["AN", 6, 2, 6], ["FU", 3, [0, 1]], ["SP", 3, 0, 40, [1], 1], ["AN", 3, 1, 2], ["FFSP", 3, 0, [1, 0], 1, 1], ["AN", 3, 1, 6], ["FU", 1, [0, 1]], ["SP", 1, 0, 20, [5], 1], ["AN", 1, 1, 2], ["FFSP", 1, 0, [1, 0], 1, 1], ["AN", 1, 1, 6], ["PR", 4, 0, "auto_unroll_max_step$0"]]]], "r": [[0.0214911, 0.0170084, 0.0172383], 0, 12.9494, 1628775183], "v": "v0.6"}
{"i": [["[\"9847f8cc0b305137f49f2c5c0c8ab25d\", 1, 1280, 1000, 1280, 1000, 1, 1000]", "opencl -keys=opencl,gpu -max_num_threads=256 -thread_warp_size=1", [2, 16, 64, 4096, 4096000, 512, 2, 8], "llvm -keys=cpu -link-params=0 -mtriple=aarch64-linux-gnu", 0, []], [[], [["SP", 2, 0, 1, [1, 1, 1, 1], 1], ["SP", 2, 5, 1000, [1, 10, 1, 1], 1], ["SP", 2, 10, 1280, [16, 2], 1], ["RE", 2, [0, 5, 1, 6, 2, 7, 10, 11, 3, 8, 12, 4, 9]], ["FSP", 4, 0, 0, 3], ["FSP", 4, 4, 1, 3], ["RE", 4, [0, 4, 1, 5, 2, 6, 3, 7]], ["CA", 2, 4, 5], ["CHR", 1, "shared", [2]], ["CA", 2, 3, 6], ["CHR", 0, "shared", [3]], ["CA", 1, 4, 6], ["FU", 6, [0, 1]], ["AN", 6, 0, 5], ["FU", 6, [1, 2]], ["AN", 6, 1, 4], ["FU", 6, [2, 3]], ["AN", 6, 2, 6], ["FU", 3, [0, 1]], ["SP", 3, 0, 64, [1], 1], ["AN", 3, 1, 2], ["FFSP", 3, 0, [1, 0], 1, 1], ["AN", 3, 1, 6], ["FU", 1, [0, 1]], ["SP", 1, 0, 64, [1], 1], ["AN", 1, 1, 2], ["FFSP", 1, 0, [1, 0], 1, 1], ["AN", 1, 1, 6], ["PR", 4, 0, "auto_unroll_max_step$512"]]]], "r": [[0.00469399, 0.00470089, 0.00473227], 0, 8.97418, 1628775192], "v": "v0.6"}
{"i": [["[\"9847f8cc0b305137f49f2c5c0c8ab25d\", 1, 1280, 1000, 1280, 1000, 1, 1000]", "opencl -keys=opencl,gpu -max_num_threads=256 -thread_warp_size=1", [2, 16, 64, 4096, 4096000, 512, 2, 8], "llvm -keys=cpu -link-params=0 -mtriple=aarch64-linux-gnu", 0, []], [[], [["SP", 2, 0, 1, [1, 1, 1, 1], 1], ["SP", 2, 5, 1000, [1, 100, 1, 2], 1], ["SP", 2, 10, 1280, [1, 1], 1], ["RE", 2, [0, 5, 1, 6, 2, 7, 10, 11, 3, 8, 12, 4, 9]], ["FSP", 4, 0, 0, 3], ["FSP", 4, 4, 1, 3], ["RE", 4, [0, 4, 1, 5, 2, 6, 3, 7]], ["CA", 2, 4, 5], ["CHR", 1, "shared", [2]], ["CA", 2, 3, 6], ["CHR", 0, "shared", [3]], ["CA", 1, 4, 6], ["FU", 6, [0, 1]], ["AN", 6, 0, 5], ["FU", 6, [1, 2]], ["AN", 6, 1, 4], ["FU", 6, [2, 3]], ["AN", 6, 2, 6], ["FU", 3, [0, 1]], ["SP", 3, 0, 10, [2], 1], ["AN", 3, 1, 2], ["FFSP", 3, 0, [1, 0], 1, 1], ["AN", 3, 1, 6], ["FU", 1, [0, 1]], ["SP", 1, 0, 5, [5], 1], ["AN", 1, 1, 2], ["FFSP", 1, 0, [1, 0], 1, 1], ["AN", 1, 1, 6], ["PR", 4, 0, "auto_unroll_max_step$1024"]]]], "r": [[0.0102583, 0.0101099, 0.0101951], 0, 12.6254, 1628775204], "v": "v0.6"}
{"i": [["[\"9847f8cc0b305137f49f2c5c0c8ab25d\", 1, 1280, 1000, 1280, 1000, 1, 1000]", "opencl -keys=opencl,gpu -max_num_threads=256 -thread_warp_size=1", [2, 16, 64, 4096, 4096000, 512, 2, 8], "llvm -keys=cpu -link-params=0 -mtriple=aarch64-linux-gnu", 0, []], [[], [["SP", 2, 0, 1, [1, 1, 1, 1], 1], ["SP", 2, 5, 1000, [1, 10, 1, 1], 1], ["SP", 2, 10, 1280, [16, 4], 1], ["RE", 2, [0, 5, 1, 6, 2, 7, 10, 11, 3, 8, 12, 4, 9]], ["FSP", 4, 0, 0, 3], ["FSP", 4, 4, 1, 3], ["RE", 4, [0, 4, 1, 5, 2, 6, 3, 7]], ["CA", 2, 4, 5], ["CHR", 1, "shared", [2]], ["CA", 2, 3, 6], ["CHR", 0, "shared", [3]], ["CA", 1, 4, 6], ["FU", 6, [0, 1]], ["AN", 6, 0, 5], ["FU", 6, [1, 2]], ["AN", 6, 1, 4], ["FU", 6, [2, 3]], ["AN", 6, 2, 6], ["FU", 3, [0, 1]], ["SP", 3, 0, 64, [4], 1], ["AN", 3, 1, 2], ["FFSP", 3, 0, [1, 0], 1, 1], ["AN", 3, 1, 6], ["FU", 1, [0, 1]], ["SP", 1, 0, 64, [1], 1], ["AN", 1, 1, 2], ["FFSP", 1, 0, [1, 0], 1, 1], ["AN", 1, 1, 6], ["PR", 4, 0, "auto_unroll_max_step$0"]]]], "r": [[0.00283027, 0.00279169, 0.0030543], 0, 5.16432, 1628775208], "v": "v0.6"}
{"i": [["[\"9847f8cc0b305137f49f2c5c0c8ab25d\", 1, 1280, 1000, 1280, 1000, 1, 1000]", "opencl -keys=opencl,gpu -max_num_threads=256 -thread_warp_size=1", [2, 16, 64, 4096, 4096000, 512, 2, 8], "llvm -keys=cpu -link-params=0 -mtriple=aarch64-linux-gnu", 0, []], [[], [["SP", 2, 0, 1, [1, 1, 1, 1], 1], ["SP", 2, 5, 1000, [1, 20, 1, 1], 1], ["SP", 2, 10, 1280, [10, 1], 1], ["RE", 2, [0, 5, 1, 6, 2, 7, 10, 11, 3, 8, 12, 4, 9]], ["FSP", 4, 0, 0, 3], ["FSP", 4, 4, 1, 3], ["RE", 4, [0, 4, 1, 5, 2, 6, 3, 7]], ["CA", 2, 4, 5], ["CHR", 1, "shared", [2]], ["CA", 2, 3, 6], ["CHR", 0, "shared", [3]], ["CA", 1, 4, 6], ["FU", 6, [0, 1]], ["AN", 6, 0, 5], ["FU", 6, [1, 2]], ["AN", 6, 1, 4], ["FU", 6, [2, 3]], ["AN", 6, 2, 6], ["FU", 3, [0, 1]], ["SP", 3, 0, 20, [2], 1], ["AN", 3, 1, 2], ["FFSP", 3, 0, [1, 0], 1, 1], ["AN", 3, 1, 6], ["FU", 1, [0, 1]], ["SP", 1, 0, 10, [1], 1], ["AN", 1, 1, 2], ["FFSP", 1, 0, [1, 0], 1, 1], ["AN", 1, 1, 6], ["PR", 4, 0, "auto_unroll_max_step$0"]]]], "r": [[0.0146177, 0.00239941, 0.0025846], 0, 4.45024, 1628775212], "v": "v0.6"}
{"i": [["[\"9847f8cc0b305137f49f2c5c0c8ab25d\", 1, 1280, 1000, 1280, 1000, 1, 1000]", "opencl -keys=opencl,gpu -max_num_threads=256 -thread_warp_size=1", [2, 16, 64, 4096, 4096000, 512, 2, 8], "llvm -keys=cpu -link-params=0 -mtriple=aarch64-linux-gnu", 0, []], [[], [["SP", 2, 0, 1, [1, 1, 1, 1], 1], ["SP", 2, 5, 1000, [1, 125, 4, 1], 1], ["SP", 2, 10, 1280, [2, 1], 1], ["RE", 2, [0, 5, 1, 6, 2, 7, 10, 11, 3, 8, 12, 4, 9]], ["FSP", 4, 0, 0, 3], ["FSP", 4, 4, 1, 3], ["RE", 4, [0, 4, 1, 5, 2, 6, 3, 7]], ["CA", 2, 4, 5], ["CHR", 1, "shared", [2]], ["CA", 2, 3, 6], ["CHR", 0, "shared", [3]], ["CA", 1, 4, 6], ["FU", 6, [0, 1]], ["AN", 6, 0, 5], ["FU", 6, [1, 2]], ["AN", 6, 1, 4], ["FU", 6, [2, 3]], ["AN", 6, 2, 6], ["FU", 3, [0, 1]], ["SP", 3, 0, 8, [4], 1], ["AN", 3, 1, 2], ["FFSP", 3, 0, [1, 0], 1, 1], ["AN", 3, 1, 6], ["FU", 1, [0, 1]], ["SP", 1, 0, 1, [1], 1], ["AN", 1, 1, 2], ["FFSP", 1, 0, [1, 0], 1, 1], ["AN", 1, 1, 6], ["PR", 4, 0, "auto_unroll_max_step$16"]]]], "r": [[0.0338288, 0.0147229, 0.013377], 0, 5.27566, 1628775217], "v": "v0.6"}
{"i": [["[\"9847f8cc0b305137f49f2c5c0c8ab25d\", 1, 1280, 1000, 1280, 1000, 1, 1000]", "opencl -keys=opencl,gpu -max_num_threads=256 -thread_warp_size=1", [2, 16, 64, 4096, 4096000, 512, 2, 8], "llvm -keys=cpu -link-params=0 -mtriple=aarch64-linux-gnu", 0, []], [[], [["SP", 2, 0, 1, [1, 1, 1, 1], 1], ["SP", 2, 5, 1000, [1, 10, 2, 1], 1], ["SP", 2, 10, 1280, [2, 20], 1], ["RE", 2, [0, 5, 1, 6, 2, 7, 10, 11, 3, 8, 12, 4, 9]], ["FSP", 4, 0, 0, 3], ["FSP", 4, 4, 1, 3], ["RE", 4, [0, 4, 1, 5, 2, 6, 3, 7]], ["CA", 2, 4, 5], ["CHR", 1, "shared", [2]], ["CA", 2, 3, 6], ["CHR", 0, "shared", [3]], ["CA", 1, 4, 6], ["FU", 6, [0, 1]], ["AN", 6, 0, 5], ["FU", 6, [1, 2]], ["AN", 6, 1, 4], ["FU", 6, [2, 3]], ["AN", 6, 2, 6], ["FU", 3, [0, 1]], ["SP", 3, 0, 80, [1], 1], ["AN", 3, 1, 2], ["FFSP", 3, 0, [1, 0], 1, 1], ["AN", 3, 1, 6], ["FU", 1, [0, 1]], ["SP", 1, 0, 40, [1], 1], ["AN", 1, 1, 2], ["FFSP", 1, 0, [1, 0], 1, 1], ["AN", 1, 1, 6], ["PR", 4, 0, "auto_unroll_max_step$0"]]]], "r": [[0.00899978, 0.00901153, 0.00941886], 0, 4.52687, 1628775222], "v": "v0.6"}
{"i": [["[\"9847f8cc0b305137f49f2c5c0c8ab25d\", 1, 1280, 1000, 1280, 1000, 1, 1000]", "opencl -keys=opencl,gpu -max_num_threads=256 -thread_warp_size=1", [2, 16, 64, 4096, 4096000, 512, 2, 8], "llvm -keys=cpu -link-params=0 -mtriple=aarch64-linux-gnu", 0, []], [[], [["SP", 2, 0, 1, [1, 1, 1, 1], 1], ["SP", 2, 5, 1000, [1, 20, 1, 1], 1], ["SP", 2, 10, 1280, [1, 1], 1], ["RE", 2, [0, 5, 1, 6, 2, 7, 10, 11, 3, 8, 12, 4, 9]], ["FSP", 4, 0, 0, 3], ["FSP", 4, 4, 1, 3], ["RE", 4, [0, 4, 1, 5, 2, 6, 3, 7]], ["CA", 2, 4, 5], ["CHR", 1, "shared", [2]], ["CA", 2, 3, 6], ["CHR", 0, "shared", [3]], ["CA", 1, 4, 6], ["FU", 6, [0, 1]], ["AN", 6, 0, 5], ["FU", 6, [1, 2]], ["AN", 6, 1, 4], ["FU", 6, [2, 3]], ["AN", 6, 2, 6], ["FU", 3, [0, 1]], ["SP", 3, 0, 5, [1], 1], ["AN", 3, 1, 2], ["FFSP", 3, 0, [1, 0], 1, 1], ["AN", 3, 1, 6], ["FU", 1, [0, 1]], ["SP", 1, 0, 1, [1], 1], ["AN", 1, 1, 2], ["FFSP", 1, 0, [1, 0], 1, 1], ["AN", 1, 1, 6], ["PR", 4, 0, "auto_unroll_max_step$512"]]]], "r": [[0.0333519, 0.00769613, 0.00770356], 0, 9.302, 1628775231], "v": "v0.6"}
{"i": [["[\"9847f8cc0b305137f49f2c5c0c8ab25d\", 1, 1280, 1000, 1280, 1000, 1, 1000]", "opencl -keys=opencl,gpu -max_num_threads=256 -thread_warp_size=1", [2, 16, 64, 4096, 4096000, 512, 2, 8], "llvm -keys=cpu -link-params=0 -mtriple=aarch64-linux-gnu", 0, []], [[], [["SP", 2, 0, 1, [1, 1, 1, 1], 1], ["SP", 2, 5, 1000, [1, 20, 1, 1], 1], ["SP", 2, 10, 1280, [8, 5], 1], ["RE", 2, [0, 5, 1, 6, 2, 7, 10, 11, 3, 8, 12, 4, 9]], ["FSP", 4, 0, 0, 3], ["FSP", 4, 4, 1, 3], ["RE", 4, [0, 4, 1, 5, 2, 6, 3, 7]], ["CA", 2, 4, 5], ["CHR", 1, "shared", [2]], ["CA", 2, 3, 6], ["CHR", 0, "shared", [3]], ["CA", 1, 4, 6], ["FU", 6, [0, 1]], ["AN", 6, 0, 5], ["FU", 6, [1, 2]], ["AN", 6, 1, 4], ["FU", 6, [2, 3]], ["AN", 6, 2, 6], ["FU", 3, [0, 1]], ["SP", 3, 0, 80, [1], 1], ["AN", 3, 1, 2], ["FFSP", 3, 0, [1, 0], 1, 1], ["AN", 3, 1, 6], ["FU", 1, [0, 1]], ["SP", 1, 0, 40, [8], 1], ["AN", 1, 1, 2], ["FFSP", 1, 0, [1, 0], 1, 1], ["AN", 1, 1, 6], ["PR", 4, 0, "auto_unroll_max_step$512"]]]], "r": [[0.00416969, 0.00419866, 0.00451103], 0, 5.93412, 1628775236], "v": "v0.6"}
{"i": [["[\"9847f8cc0b305137f49f2c5c0c8ab25d\", 1, 1280, 1000, 1280, 1000, 1, 1000]", "opencl -keys=opencl,gpu -max_num_threads=256 -thread_warp_size=1", [2, 16, 64, 4096, 4096000, 512, 2, 8], "llvm -keys=cpu -link-params=0 -mtriple=aarch64-linux-gnu", 0, []], [[], [["SP", 2, 0, 1, [1, 1, 1, 1], 1], ["SP", 2, 5, 1000, [1, 10, 1, 2], 1], ["SP", 2, 10, 1280, [4, 1], 1], ["RE", 2, [0, 5, 1, 6, 2, 7, 10, 11, 3, 8, 12, 4, 9]], ["FSP", 4, 0, 0, 3], ["FSP", 4, 4, 1, 3], ["RE", 4, [0, 4, 1, 5, 2, 6, 3, 7]], ["CA", 2, 4, 5], ["CHR", 1, "shared", [2]], ["CA", 2, 3, 6], ["CHR", 0, "shared", [3]], ["CA", 1, 4, 6], ["FU", 6, [0, 1]], ["AN", 6, 0, 5], ["FU", 6, [1, 2]], ["AN", 6, 1, 4], ["FU", 6, [2, 3]], ["AN", 6, 2, 6], ["FU", 3, [0, 1]], ["SP", 3, 0, 4, [1], 1], ["AN", 3, 1, 2], ["FFSP", 3, 0, [1, 0], 1, 1], ["AN", 3, 1, 6], ["FU", 1, [0, 1]], ["SP", 1, 0, 4, [1], 1], ["AN", 1, 1, 2], ["FFSP", 1, 0, [1, 0], 1, 1], ["AN", 1, 1, 6], ["PR", 4, 0, "auto_unroll_max_step$0"]]]], "r": [[0.00510359, 0.00532998, 0.0053751], 0, 15.6324, 1628775252], "v": "v0.6"}
{"i": [["[\"9847f8cc0b305137f49f2c5c0c8ab25d\", 1, 1280, 1000, 1280, 1000, 1, 1000]", "opencl -keys=opencl,gpu -max_num_threads=256 -thread_warp_size=1", [2, 16, 64, 4096, 4096000, 512, 2, 8], "llvm -keys=cpu -link-params=0 -mtriple=aarch64-linux-gnu", 0, []], [[], [["SP", 2, 0, 1, [1, 1, 1, 1], 1], ["SP", 2, 5, 1000, [1, 20, 1, 1], 1], ["SP", 2, 10, 1280, [1, 20], 1], ["RE", 2, [0, 5, 1, 6, 2, 7, 10, 11, 3, 8, 12, 4, 9]], ["FSP", 4, 0, 0, 3], ["FSP", 4, 4, 1, 3], ["RE", 4, [0, 4, 1, 5, 2, 6, 3, 7]], ["CA", 2, 4, 5], ["CHR", 1, "shared", [2]], ["CA", 2, 3, 6], ["CHR", 0, "shared", [3]], ["CA", 1, 4, 6], ["FU", 6, [0, 1]], ["AN", 6, 0, 5], ["FU", 6, [1, 2]], ["AN", 6, 1, 4], ["FU", 6, [2, 3]], ["AN", 6, 2, 6], ["FU", 3, [0, 1]], ["SP", 3, 0, 40, [1], 1], ["AN", 3, 1, 2], ["FFSP", 3, 0, [1, 0], 1, 1], ["AN", 3, 1, 6], ["FU", 1, [0, 1]], ["SP", 1, 0, 40, [1], 1], ["AN", 1, 1, 2], ["FFSP", 1, 0, [1, 0], 1, 1], ["AN", 1, 1, 6], ["PR", 4, 0, "auto_unroll_max_step$1024"]]]], "r": [[0.00381103, 0.00425428, 0.00425581], 0, 5.49648, 1628775257], "v": "v0.6"}
{"i": [["[\"9847f8cc0b305137f49f2c5c0c8ab25d\", 1, 1280, 1000, 1280, 1000, 1, 1000]", "opencl -keys=opencl,gpu -max_num_threads=256 -thread_warp_size=1", [2, 16, 64, 4096, 4096000, 512, 2, 8], "llvm -keys=cpu -link-params=0 -mtriple=aarch64-linux-gnu", 0, []], [[], [["SP", 2, 0, 1, [1, 1, 1, 1], 1], ["SP", 2, 5, 1000, [2, 250, 1, 1], 1], ["SP", 2, 10, 1280, [2, 1], 1], ["RE", 2, [0, 5, 1, 6, 2, 7, 10, 11, 3, 8, 12, 4, 9]], ["FSP", 4, 0, 0, 3], ["FSP", 4, 4, 1, 3], ["RE", 4, [0, 4, 1, 5, 2, 6, 3, 7]], ["CA", 2, 4, 5], ["CHR", 1, "shared", [2]], ["CA", 2, 3, 6], ["CHR", 0, "shared", [3]], ["CA", 1, 4, 6], ["FU", 6, [0, 1]], ["AN", 6, 0, 5], ["FU", 6, [1, 2]], ["AN", 6, 1, 4], ["FU", 6, [2, 3]], ["AN", 6, 2, 6], ["FU", 3, [0, 1]], ["SP", 3, 0, 4, [1], 1], ["AN", 3, 1, 2], ["FFSP", 3, 0, [1, 0], 1, 1], ["AN", 3, 1, 6], ["FU", 1, [0, 1]], ["SP", 1, 0, 2, [1], 1], ["AN", 1, 1, 2], ["FFSP", 1, 0, [1, 0], 1, 1], ["AN", 1, 1, 6], ["PR", 4, 0, "auto_unroll_max_step$1024"]]]], "r": [[0.00847619, 0.00860133, 0.00884053], 0, 13.8417, 1628775271], "v": "v0.6"}
{"i": [["[\"9847f8cc0b305137f49f2c5c0c8ab25d\", 1, 1280, 1000, 1280, 1000, 1, 1000]", "opencl -keys=opencl,gpu -max_num_threads=256 -thread_warp_size=1", [2, 16, 64, 4096, 4096000, 512, 2, 8], "llvm -keys=cpu -link-params=0 -mtriple=aarch64-linux-gnu", 0, []], [[], [["SP", 2, 0, 1, [1, 1, 1, 1], 1], ["SP", 2, 5, 1000, [1, 25, 5, 1], 1], ["SP", 2, 10, 1280, [1, 2], 1], ["RE", 2, [0, 5, 1, 6, 2, 7, 10, 11, 3, 8, 12, 4, 9]], ["FSP", 4, 0, 0, 3], ["FSP", 4, 4, 1, 3], ["RE", 4, [0, 4, 1, 5, 2, 6, 3, 7]], ["CA", 2, 4, 5], ["CHR", 1, "shared", [2]], ["CA", 2, 3, 6], ["CHR", 0, "shared", [3]], ["CA", 1, 4, 6], ["FU", 6, [0, 1]], ["AN", 6, 0, 5], ["FU", 6, [1, 2]], ["AN", 6, 1, 4], ["FU", 6, [2, 3]], ["AN", 6, 2, 6], ["FU", 3, [0, 1]], ["SP", 3, 0, 10, [1], 1], ["AN", 3, 1, 2], ["FFSP", 3, 0, [1, 0], 1, 1], ["AN", 3, 1, 6], ["FU", 1, [0, 1]], ["SP", 1, 0, 2, [1], 1], ["AN", 1, 1, 2], ["FFSP", 1, 0, [1, 0], 1, 1], ["AN", 1, 1, 6], ["PR", 4, 0, "auto_unroll_max_step$0"]]]], "r": [[0.00782838, 0.00782505, 0.00824044], 0, 10.9011, 1628775284], "v": "v0.6"}
{"i": [["[\"9847f8cc0b305137f49f2c5c0c8ab25d\", 1, 1280, 1000, 1280, 1000, 1, 1000]", "opencl -keys=opencl,gpu -max_num_threads=256 -thread_warp_size=1", [2, 16, 64, 4096, 4096000, 512, 2, 8], "llvm -keys=cpu -link-params=0 -mtriple=aarch64-linux-gnu", 0, []], [[], [["SP", 2, 0, 1, [1, 1, 1, 1], 1], ["SP", 2, 5, 1000, [1, 10, 2, 5], 1], ["SP", 2, 10, 1280, [1, 1], 1], ["RE", 2, [0, 5, 1, 6, 2, 7, 10, 11, 3, 8, 12, 4, 9]], ["FSP", 4, 0, 0, 3], ["FSP", 4, 4, 1, 3], ["RE", 4, [0, 4, 1, 5, 2, 6, 3, 7]], ["CA", 2, 4, 5], ["CHR", 1, "shared", [2]], ["CA", 2, 3, 6], ["CHR", 0, "shared", [3]], ["CA", 1, 4, 6], ["FU", 6, [0, 1]], ["AN", 6, 0, 5], ["FU", 6, [1, 2]], ["AN", 6, 1, 4], ["FU", 6, [2, 3]], ["AN", 6, 2, 6], ["FU", 3, [0, 1]], ["SP", 3, 0, 100, [1], 1], ["AN", 3, 1, 2], ["FFSP", 3, 0, [1, 0], 1, 1], ["AN", 3, 1, 6], ["FU", 1, [0, 1]], ["SP", 1, 0, 10, [5], 1], ["AN", 1, 1, 2], ["FFSP", 1, 0, [1, 0], 1, 1], ["AN", 1, 1, 6], ["PR", 4, 0, "auto_unroll_max_step$1024"]]]], "r": [[0.0365739, 0.0328363, 0.0338225], 0, 4.42975, 1628775286], "v": "v0.6"}
{"i": [["[\"9847f8cc0b305137f49f2c5c0c8ab25d\", 1, 1280, 1000, 1280, 1000, 1, 1000]", "opencl -keys=opencl,gpu -max_num_threads=256 -thread_warp_size=1", [2, 16, 64, 4096, 4096000, 512, 2, 8], "llvm -keys=cpu -link-params=0 -mtriple=aarch64-linux-gnu", 0, []], [[], [["SP", 2, 0, 1, [1, 1, 1, 1], 1], ["SP", 2, 5, 1000, [1, 10, 1, 2], 1], ["SP", 2, 10, 1280, [4, 4], 1], ["RE", 2, [0, 5, 1, 6, 2, 7, 10, 11, 3, 8, 12, 4, 9]], ["FSP", 4, 0, 0, 3], ["FSP", 4, 4, 1, 3], ["RE", 4, [0, 4, 1, 5, 2, 6, 3, 7]], ["CA", 2, 4, 5], ["CHR", 1, "shared", [2]], ["CA", 2, 3, 6], ["CHR", 0, "shared", [3]], ["CA", 1, 4, 6], ["FU", 6, [0, 1]], ["AN", 6, 0, 5], ["FU", 6, [1, 2]], ["AN", 6, 1, 4], ["FU", 6, [2, 3]], ["AN", 6, 2, 6], ["FU", 3, [0, 1]], ["SP", 3, 0, 16, [1], 1], ["AN", 3, 1, 2], ["FFSP", 3, 0, [1, 0], 1, 1], ["AN", 3, 1, 6], ["FU", 1, [0, 1]], ["SP", 1, 0, 16, [2], 1], ["AN", 1, 1, 2], ["FFSP", 1, 0, [1, 0], 1, 1], ["AN", 1, 1, 6], ["PR", 4, 0, "auto_unroll_max_step$0"]]]], "r": [[0.0356228, 0.00618608, 0.00633902], 0, 4.37046, 1628775287], "v": "v0.6"}
{"i": [["[\"9847f8cc0b305137f49f2c5c0c8ab25d\", 1, 1280, 1000, 1280, 1000, 1, 1000]", "opencl -keys=opencl,gpu -max_num_threads=256 -thread_warp_size=1", [2, 16, 64, 4096, 4096000, 512, 2, 8], "llvm -keys=cpu -link-params=0 -mtriple=aarch64-linux-gnu", 0, []], [[], [["SP", 2, 0, 1, [1, 1, 1, 1], 1], ["SP", 2, 5, 1000, [2, 10, 1, 1], 1], ["SP", 2, 10, 1280, [4, 2], 1], ["RE", 2, [0, 5, 1, 6, 2, 7, 10, 11, 3, 8, 12, 4, 9]], ["FSP", 4, 0, 0, 3], ["FSP", 4, 4, 1, 3], ["RE", 4, [0, 4, 1, 5, 2, 6, 3, 7]], ["CA", 2, 4, 5], ["CHR", 1, "shared", [2]], ["CA", 2, 3, 6], ["CHR", 0, "shared", [3]], ["CA", 1, 4, 6], ["FU", 6, [0, 1]], ["AN", 6, 0, 5], ["FU", 6, [1, 2]], ["AN", 6, 1, 4], ["FU", 6, [2, 3]], ["AN", 6, 2, 6], ["FU", 3, [0, 1]], ["SP", 3, 0, 8, [1], 1], ["AN", 3, 1, 2], ["FFSP", 3, 0, [1, 0], 1, 1], ["AN", 3, 1, 6], ["FU", 1, [0, 1]], ["SP", 1, 0, 8, [4], 1], ["AN", 1, 1, 2], ["FFSP", 1, 0, [1, 0], 1, 1], ["AN", 1, 1, 6], ["PR", 4, 0, "auto_unroll_max_step$64"]]]], "r": [[0.00439406, 0.00450275, 0.00488487], 0, 3.76407, 1628775290], "v": "v0.6"}
{"i": [["[\"9847f8cc0b305137f49f2c5c0c8ab25d\", 1, 1280, 1000, 1280, 1000, 1, 1000]", "opencl -keys=opencl,gpu -max_num_threads=256 -thread_warp_size=1", [2, 16, 64, 4096, 4096000, 512, 2, 8], "llvm -keys=cpu -link-params=0 -mtriple=aarch64-linux-gnu", 0, []], [[], [["SP", 2, 0, 1, [1, 1, 1, 1], 1], ["SP", 2, 5, 1000, [1, 10, 5, 2], 1], ["SP", 2, 10, 1280, [5, 2], 1], ["RE", 2, [0, 5, 1, 6, 2, 7, 10, 11, 3, 8, 12, 4, 9]], ["FSP", 4, 0, 0, 3], ["FSP", 4, 4, 1, 3], ["RE", 4, [0, 4, 1, 5, 2, 6, 3, 7]], ["CA", 2, 4, 5], ["CHR", 1, "shared", [2]], ["CA", 2, 3, 6], ["CHR", 0, "shared", [3]], ["CA", 1, 4, 6], ["FU", 6, [0, 1]], ["AN", 6, 0, 5], ["FU", 6, [1, 2]], ["AN", 6, 1, 4], ["FU", 6, [2, 3]], ["AN", 6, 2, 6], ["FU", 3, [0, 1]], ["SP", 3, 0, 50, [1], 1], ["AN", 3, 1, 2], ["FFSP", 3, 0, [1, 0], 1, 1], ["AN", 3, 1, 6], ["FU", 1, [0, 1]], ["SP", 1, 0, 10, [1], 1], ["AN", 1, 1, 2], ["FFSP", 1, 0, [1, 0], 1, 1], ["AN", 1, 1, 6], ["PR", 4, 0, "auto_unroll_max_step$64"]]]], "r": [[0.0118568, 0.0118067, 0.0121893], 0, 4.4782, 1628775293], "v": "v0.6"}
{"i": [["[\"9847f8cc0b305137f49f2c5c0c8ab25d\", 1, 1280, 1000, 1280, 1000, 1, 1000]", "opencl -keys=opencl,gpu -max_num_threads=256 -thread_warp_size=1", [2, 16, 64, 4096, 4096000, 512, 2, 8], "llvm -keys=cpu -link-params=0 -mtriple=aarch64-linux-gnu", 0, []], [[], [["SP", 2, 0, 1, [1, 1, 1, 1], 1], ["SP", 2, 5, 1000, [1, 20, 1, 1], 1], ["SP", 2, 10, 1280, [2, 2], 1], ["RE", 2, [0, 5, 1, 6, 2, 7, 10, 11, 3, 8, 12, 4, 9]], ["FSP", 4, 0, 0, 3], ["FSP", 4, 4, 1, 3], ["RE", 4, [0, 4, 1, 5, 2, 6, 3, 7]], ["CA", 2, 4, 5], ["CHR", 1, "shared", [2]], ["CA", 2, 3, 6], ["CHR", 0, "shared", [3]], ["CA", 1, 4, 6], ["FU", 6, [0, 1]], ["AN", 6, 0, 5], ["FU", 6, [1, 2]], ["AN", 6, 1, 4], ["FU", 6, [2, 3]], ["AN", 6, 2, 6], ["FU", 3, [0, 1]], ["SP", 3, 0, 4, [1], 1], ["AN", 3, 1, 2], ["FFSP", 3, 0, [1, 0], 1, 1], ["AN", 3, 1, 6], ["FU", 1, [0, 1]], ["SP", 1, 0, 4, [2], 1], ["AN", 1, 1, 2], ["FFSP", 1, 0, [1, 0], 1, 1], ["AN", 1, 1, 6], ["PR", 4, 0, "auto_unroll_max_step$512"]]]], "r": [[0.00463281, 0.00434799, 0.00435407], 0, 5.40269, 1628775297], "v": "v0.6"}
{"i": [["[\"9847f8cc0b305137f49f2c5c0c8ab25d\", 1, 1280, 1000, 1280, 1000, 1, 1000]", "opencl -keys=opencl,gpu -max_num_threads=256 -thread_warp_size=1", [2, 16, 64, 4096, 4096000, 512, 2, 8], "llvm -keys=cpu -link-params=0 -mtriple=aarch64-linux-gnu", 0, []], [[], [["SP", 2, 0, 1, [1, 1, 1, 1], 1], ["SP", 2, 5, 1000, [1, 50, 1, 2], 1], ["SP", 2, 10, 1280, [8, 1], 1], ["RE", 2, [0, 5, 1, 6, 2, 7, 10, 11, 3, 8, 12, 4, 9]], ["FSP", 4, 0, 0, 3], ["FSP", 4, 4, 1, 3], ["RE", 4, [0, 4, 1, 5, 2, 6, 3, 7]], ["CA", 2, 4, 5], ["CHR", 1, "shared", [2]], ["CA", 2, 3, 6], ["CHR", 0, "shared", [3]], ["CA", 1, 4, 6], ["FU", 6, [0, 1]], ["AN", 6, 0, 5], ["FU", 6, [1, 2]], ["AN", 6, 1, 4], ["FU", 6, [2, 3]], ["AN", 6, 2, 6], ["FU", 3, [0, 1]], ["SP", 3, 0, 16, [1], 1], ["AN", 3, 1, 2], ["FFSP", 3, 0, [1, 0], 1, 1], ["AN", 3, 1, 6], ["FU", 1, [0, 1]], ["SP", 1, 0, 8, [1], 1], ["AN", 1, 1, 2], ["FFSP", 1, 0, [1, 0], 1, 1], ["AN", 1, 1, 6], ["PR", 4, 0, "auto_unroll_max_step$0"]]]], "r": [[0.0267723, 0.00366264, 0.00377421], 0, 3.22281, 1628775304], "v": "v0.6"}
{"i": [["[\"9847f8cc0b305137f49f2c5c0c8ab25d\", 1, 1280, 1000, 1280, 1000, 1, 1000]", "opencl -keys=opencl,gpu -max_num_threads=256 -thread_warp_size=1", [2, 16, 64, 4096, 4096000, 512, 2, 8], "llvm -keys=cpu -link-params=0 -mtriple=aarch64-linux-gnu", 0, []], [[], [["SP", 2, 0, 1, [1, 1, 1, 1], 1], ["SP", 2, 5, 1000, [1, 25, 20, 2], 1], ["SP", 2, 10, 1280, [1, 1], 1], ["RE", 2, [0, 5, 1, 6, 2, 7, 10, 11, 3, 8, 12, 4, 9]], ["FSP", 4, 0, 0, 3], ["FSP", 4, 4, 1, 3], ["RE", 4, [0, 4, 1, 5, 2, 6, 3, 7]], ["CA", 2, 4, 5], ["CHR", 1, "shared", [2]], ["CA", 2, 3, 6], ["CHR", 0, "shared", [3]], ["CA", 1, 4, 6], ["FU", 6, [0, 1]], ["AN", 6, 0, 5], ["FU", 6, [1, 2]], ["AN", 6, 1, 4], ["FU", 6, [2, 3]], ["AN", 6, 2, 6], ["FU", 3, [0, 1]], ["SP", 3, 0, 40, [4], 1], ["AN", 3, 1, 2], ["FFSP", 3, 0, [1, 0], 1, 1], ["AN", 3, 1, 6], ["FU", 1, [0, 1]], ["SP", 1, 0, 1, [1], 1], ["AN", 1, 1, 2], ["FFSP", 1, 0, [1, 0], 1, 1], ["AN", 1, 1, 6], ["PR", 4, 0, "auto_unroll_max_step$1024"]]]], "r": [[0.103912, 0.0696277, 0.0411084], 0, 5.11976, 1628775308], "v": "v0.6"}
{"i": [["[\"9847f8cc0b305137f49f2c5c0c8ab25d\", 1, 1280, 1000, 1280, 1000, 1, 1000]", "opencl -keys=opencl,gpu -max_num_threads=256 -thread_warp_size=1", [2, 16, 64, 4096, 4096000, 512, 2, 8], "llvm -keys=cpu -link-params=0 -mtriple=aarch64-linux-gnu", 0, []], [[], [["SP", 2, 0, 1, [1, 1, 1, 1], 1], ["SP", 2, 5, 1000, [1, 10, 2, 2], 1], ["SP", 2, 10, 1280, [8, 2], 1], ["RE", 2, [0, 5, 1, 6, 2, 7, 10, 11, 3, 8, 12, 4, 9]], ["FSP", 4, 0, 0, 3], ["FSP", 4, 4, 1, 3], ["RE", 4, [0, 4, 1, 5, 2, 6, 3, 7]], ["CA", 2, 4, 5], ["CHR", 1, "shared", [2]], ["CA", 2, 3, 6], ["CHR", 0, "shared", [3]], ["CA", 1, 4, 6], ["FU", 6, [0, 1]], ["AN", 6, 0, 5], ["FU", 6, [1, 2]], ["AN", 6, 1, 4], ["FU", 6, [2, 3]], ["AN", 6, 2, 6], ["FU", 3, [0, 1]], ["SP", 3, 0, 16, [1], 1], ["AN", 3, 1, 2], ["FFSP", 3, 0, [1, 0], 1, 1], ["AN", 3, 1, 6], ["FU", 1, [0, 1]], ["SP", 1, 0, 16, [1], 1], ["AN", 1, 1, 2], ["FFSP", 1, 0, [1, 0], 1, 1], ["AN", 1, 1, 6], ["PR", 4, 0, "auto_unroll_max_step$16"]]]], "r": [[0.036158, 0.00837267, 0.00846667], 0, 5.16313, 1628775312], "v": "v0.6"}
{"i": [["[\"9847f8cc0b305137f49f2c5c0c8ab25d\", 1, 1280, 1000, 1280, 1000, 1, 1000]", "opencl -keys=opencl,gpu -max_num_threads=256 -thread_warp_size=1", [2, 16, 64, 4096, 4096000, 512, 2, 8], "llvm -keys=cpu -link-params=0 -mtriple=aarch64-linux-gnu", 0, []], [[], [["SP", 2, 0, 1, [1, 1, 1, 1], 1], ["SP", 2, 5, 1000, [1, 100, 2, 1], 1], ["SP", 2, 10, 1280, [2, 1], 1], ["RE", 2, [0, 5, 1, 6, 2, 7, 10, 11, 3, 8, 12, 4, 9]], ["FSP", 4, 0, 0, 3], ["FSP", 4, 4, 1, 3], ["RE", 4, [0, 4, 1, 5, 2, 6, 3, 7]], ["CA", 2, 4, 5], ["CHR", 1, "shared", [2]], ["CA", 2, 3, 6], ["CHR", 0, "shared", [3]], ["CA", 1, 4, 6], ["FU", 6, [0, 1]], ["AN", 6, 0, 5], ["FU", 6, [1, 2]], ["AN", 6, 1, 4], ["FU", 6, [2, 3]], ["AN", 6, 2, 6], ["FU", 3, [0, 1]], ["SP", 3, 0, 4, [1], 1], ["AN", 3, 1, 2], ["FFSP", 3, 0, [1, 0], 1, 1], ["AN", 3, 1, 6], ["FU", 1, [0, 1]], ["SP", 1, 0, 2, [2], 1], ["AN", 1, 1, 2], ["FFSP", 1, 0, [1, 0], 1, 1], ["AN", 1, 1, 6], ["PR", 4, 0, "auto_unroll_max_step$1024"]]]], "r": [[0.00537688, 0.00570279, 0.00568656], 0, 3.46206, 1628775314], "v": "v0.6"}
{"i": [["[\"9847f8cc0b305137f49f2c5c0c8ab25d\", 1, 1280, 1000, 1280, 1000, 1, 1000]", "opencl -keys=opencl,gpu -max_num_threads=256 -thread_warp_size=1", [2, 16, 64, 4096, 4096000, 512, 2, 8], "llvm -keys=cpu -link-params=0 -mtriple=aarch64-linux-gnu", 0, []], [[], [["SP", 2, 0, 1, [1, 1, 1, 1], 1], ["SP", 2, 5, 1000, [1, 50, 1, 2], 1], ["SP", 2, 10, 1280, [1, 2], 1], ["RE", 2, [0, 5, 1, 6, 2, 7, 10, 11, 3, 8, 12, 4, 9]], ["FSP", 4, 0, 0, 3], ["FSP", 4, 4, 1, 3], ["RE", 4, [0, 4, 1, 5, 2, 6, 3, 7]], ["CA", 2, 4, 5], ["CHR", 1, "shared", [2]], ["CA", 2, 3, 6], ["CHR", 0, "shared", [3]], ["CA", 1, 4, 6], ["FU", 6, [0, 1]], ["AN", 6, 0, 5], ["FU", 6, [1, 2]], ["AN", 6, 1, 4], ["FU", 6, [2, 3]], ["AN", 6, 2, 6], ["FU", 3, [0, 1]], ["SP", 3, 0, 4, [1], 1], ["AN", 3, 1, 2], ["FFSP", 3, 0, [1, 0], 1, 1], ["AN", 3, 1, 6], ["FU", 1, [0, 1]], ["SP", 1, 0, 2, [2], 1], ["AN", 1, 1, 2], ["FFSP", 1, 0, [1, 0], 1, 1], ["AN", 1, 1, 6], ["PR", 4, 0, "auto_unroll_max_step$16"]]]], "r": [[0.0276623, 0.00808118, 0.00820198], 0, 3.08509, 1628775315], "v": "v0.6"}
{"i": [["[\"9847f8cc0b305137f49f2c5c0c8ab25d\", 1, 1280, 1000, 1280, 1000, 1, 1000]", "opencl -keys=opencl,gpu -max_num_threads=256 -thread_warp_size=1", [2, 16, 64, 4096, 4096000, 512, 2, 8], "llvm -keys=cpu -link-params=0 -mtriple=aarch64-linux-gnu", 0, []], [[], [["SP", 2, 0, 1, [1, 1, 1, 1], 1], ["SP", 2, 5, 1000, [1, 1, 1, 50], 1], ["SP", 2, 10, 1280, [1, 2], 1], ["RE", 2, [0, 5, 1, 6, 2, 7, 10, 11, 3, 8, 12, 4, 9]], ["FSP", 4, 0, 0, 3], ["FSP", 4, 4, 1, 3], ["RE", 4, [0, 4, 1, 5, 2, 6, 3, 7]], ["CA", 2, 4, 5], ["CHR", 1, "shared", [2]], ["CA", 2, 3, 6], ["CHR", 0, "shared", [3]], ["CA", 1, 4, 6], ["FU", 6, [0, 1]], ["AN", 6, 0, 5], ["FU", 6, [1, 2]], ["AN", 6, 1, 4], ["FU", 6, [2, 3]], ["AN", 6, 2, 6], ["FU", 3, [0, 1]], ["SP", 3, 0, 50, [1], 1], ["AN", 3, 1, 2], ["FFSP", 3, 0, [1, 0], 1, 1], ["AN", 3, 1, 6], ["FU", 1, [0, 1]], ["SP", 1, 0, 10, [2], 1], ["AN", 1, 1, 2], ["FFSP", 1, 0, [1, 0], 1, 1], ["AN", 1, 1, 6], ["PR", 4, 0, "auto_unroll_max_step$512"]]]], "r": [[0.0197971, 0.0200535, 0.0198619], 0, 5.40228, 1628775319], "v": "v0.6"}
{"i": [["[\"9847f8cc0b305137f49f2c5c0c8ab25d\", 1, 1280, 1000, 1280, 1000, 1, 1000]", "opencl -keys=opencl,gpu -max_num_threads=256 -thread_warp_size=1", [2, 16, 64, 4096, 4096000, 512, 2, 8], "llvm -keys=cpu -link-params=0 -mtriple=aarch64-linux-gnu", 0, []], [[], [["SP", 2, 0, 1, [1, 1, 1, 1], 1], ["SP", 2, 5, 1000, [1, 10, 1, 2], 1], ["SP", 2, 10, 1280, [1, 1], 1], ["RE", 2, [0, 5, 1, 6, 2, 7, 10, 11, 3, 8, 12, 4, 9]], ["FSP", 4, 0, 0, 3], ["FSP", 4, 4, 1, 3], ["RE", 4, [0, 4, 1, 5, 2, 6, 3, 7]], ["CA", 2, 4, 5], ["CHR", 1, "shared", [2]], ["CA", 2, 3, 6], ["CHR", 0, "shared", [3]], ["CA", 1, 4, 6], ["FU", 6, [0, 1]], ["AN", 6, 0, 5], ["FU", 6, [1, 2]], ["AN", 6, 1, 4], ["FU", 6, [2, 3]], ["AN", 6, 2, 6], ["FU", 3, [0, 1]], ["SP", 3, 0, 4, [4], 1], ["AN", 3, 1, 2], ["FFSP", 3, 0, [1, 0], 1, 1], ["AN", 3, 1, 6], ["FU", 1, [0, 1]], ["SP", 1, 0, 2, [2], 1], ["AN", 1, 1, 2], ["FFSP", 1, 0, [1, 0], 1, 1], ["AN", 1, 1, 6], ["PR", 4, 0, "auto_unroll_max_step$64"]]]], "r": [[0.0195301, 0.0202251, 0.0199808], 0, 5.03201, 1628775327], "v": "v0.6"}
{"i": [["[\"9847f8cc0b305137f49f2c5c0c8ab25d\", 1, 1280, 1000, 1280, 1000, 1, 1000]", "opencl -keys=opencl,gpu -max_num_threads=256 -thread_warp_size=1", [2, 16, 64, 4096, 4096000, 512, 2, 8], "llvm -keys=cpu -link-params=0 -mtriple=aarch64-linux-gnu", 0, []], [[], [["SP", 2, 0, 1, [1, 1, 1, 1], 1], ["SP", 2, 5, 1000, [1, 10, 1, 1], 1], ["SP", 2, 10, 1280, [2, 10], 1], ["RE", 2, [0, 5, 1, 6, 2, 7, 10, 11, 3, 8, 12, 4, 9]], ["FSP", 4, 0, 0, 3], ["FSP", 4, 4, 1, 3], ["RE", 4, [0, 4, 1, 5, 2, 6, 3, 7]], ["CA", 2, 4, 5], ["CHR", 1, "shared", [2]], ["CA", 2, 3, 6], ["CHR", 0, "shared", [3]], ["CA", 1, 4, 6], ["FU", 6, [0, 1]], ["AN", 6, 0, 5], ["FU", 6, [1, 2]], ["AN", 6, 1, 4], ["FU", 6, [2, 3]], ["AN", 6, 2, 6], ["FU", 3, [0, 1]], ["SP", 3, 0, 16, [1], 1], ["AN", 3, 1, 2], ["FFSP", 3, 0, [1, 0], 1, 1], ["AN", 3, 1, 6], ["FU", 1, [0, 1]], ["SP", 1, 0, 16, [16], 1], ["AN", 1, 1, 2], ["FFSP", 1, 0, [1, 0], 1, 1], ["AN", 1, 1, 6], ["PR", 4, 0, "auto_unroll_max_step$512"]]]], "r": [[0.00388133, 0.00390672, 0.00394585], 0, 4.98771, 1628775331], "v": "v0.6"}
{"i": [["[\"9847f8cc0b305137f49f2c5c0c8ab25d\", 1, 1280, 1000, 1280, 1000, 1, 1000]", "opencl -keys=opencl,gpu -max_num_threads=256 -thread_warp_size=1", [2, 16, 64, 4096, 4096000, 512, 2, 8], "llvm -keys=cpu -link-params=0 -mtriple=aarch64-linux-gnu", 0, []], [[], [["SP", 2, 0, 1, [1, 1, 1, 1], 1], ["SP", 2, 5, 1000, [2, 5, 2, 1], 1], ["SP", 2, 10, 1280, [8, 5], 1], ["RE", 2, [0, 5, 1, 6, 2, 7, 10, 11, 3, 8, 12, 4, 9]], ["FSP", 4, 0, 0, 3], ["FSP", 4, 4, 1, 3], ["RE", 4, [0, 4, 1, 5, 2, 6, 3, 7]], ["CA", 2, 4, 5], ["CHR", 1, "shared", [2]], ["CA", 2, 3, 6], ["CHR", 0, "shared", [3]], ["CA", 1, 4, 6], ["FU", 6, [0, 1]], ["AN", 6, 0, 5], ["FU", 6, [1, 2]], ["AN", 6, 1, 4], ["FU", 6, [2, 3]], ["AN", 6, 2, 6], ["FU", 3, [0, 1]], ["SP", 3, 0, 80, [1], 1], ["AN", 3, 1, 2], ["FFSP", 3, 0, [1, 0], 1, 1], ["AN", 3, 1, 6], ["FU", 1, [0, 1]], ["SP", 1, 0, 40, [1], 1], ["AN", 1, 1, 2], ["FFSP", 1, 0, [1, 0], 1, 1], ["AN", 1, 1, 6], ["PR", 4, 0, "auto_unroll_max_step$64"]]]], "r": [[0.102732, 0.103068, 0.102858], 0, 6.60711, 1628775335], "v": "v0.6"}
{"i": [["[\"9847f8cc0b305137f49f2c5c0c8ab25d\", 1, 1280, 1000, 1280, 1000, 1, 1000]", "opencl -keys=opencl,gpu -max_num_threads=256 -thread_warp_size=1", [2, 16, 64, 4096, 4096000, 512, 2, 8], "llvm -keys=cpu -link-params=0 -mtriple=aarch64-linux-gnu", 0, []], [[], [["SP", 2, 0, 1, [1, 1, 1, 1], 1], ["SP", 2, 5, 1000, [1, 50, 1, 1], 1], ["SP", 2, 10, 1280, [8, 1], 1], ["RE", 2, [0, 5, 1, 6, 2, 7, 10, 11, 3, 8, 12, 4, 9]], ["FSP", 4, 0, 0, 3], ["FSP", 4, 4, 1, 3], ["RE", 4, [0, 4, 1, 5, 2, 6, 3, 7]], ["CA", 2, 4, 5], ["CHR", 1, "shared", [2]], ["CA", 2, 3, 6], ["CHR", 0, "shared", [3]], ["CA", 1, 4, 6], ["FU", 6, [0, 1]], ["AN", 6, 0, 5], ["FU", 6, [1, 2]], ["AN", 6, 1, 4], ["FU", 6, [2, 3]], ["AN", 6, 2, 6], ["FU", 3, [0, 1]], ["SP", 3, 0, 16, [1], 1], ["AN", 3, 1, 2], ["FFSP", 3, 0, [1, 0], 1, 1], ["AN", 3, 1, 6], ["FU", 1, [0, 1]], ["SP", 1, 0, 8, [4], 1], ["AN", 1, 1, 2], ["FFSP", 1, 0, [1, 0], 1, 1], ["AN", 1, 1, 6], ["PR", 4, 0, "auto_unroll_max_step$64"]]]], "r": [[0.00373884, 0.00376754, 0.00396786], 0, 6.36092, 1628775340], "v": "v0.6"}
{"i": [["[\"9847f8cc0b305137f49f2c5c0c8ab25d\", 1, 1280, 1000, 1280, 1000, 1, 1000]", "opencl -keys=opencl,gpu -max_num_threads=256 -thread_warp_size=1", [2, 16, 64, 4096, 4096000, 512, 2, 8], "llvm -keys=cpu -link-params=0 -mtriple=aarch64-linux-gnu", 0, []], [[], [["SP", 2, 0, 1, [1, 1, 1, 1], 1], ["SP", 2, 5, 1000, [1, 25, 1, 1], 1], ["SP", 2, 10, 1280, [20, 1], 1], ["RE", 2, [0, 5, 1, 6, 2, 7, 10, 11, 3, 8, 12, 4, 9]], ["FSP", 4, 0, 0, 3], ["FSP", 4, 4, 1, 3], ["RE", 4, [0, 4, 1, 5, 2, 6, 3, 7]], ["CA", 2, 4, 5], ["CHR", 1, "shared", [2]], ["CA", 2, 3, 6], ["CHR", 0, "shared", [3]], ["CA", 1, 4, 6], ["FU", 6, [0, 1]], ["AN", 6, 0, 5], ["FU", 6, [1, 2]], ["AN", 6, 1, 4], ["FU", 6, [2, 3]], ["AN", 6, 2, 6], ["FU", 3, [0, 1]], ["SP", 3, 0, 40, [1], 1], ["AN", 3, 1, 2], ["FFSP", 3, 0, [1, 0], 1, 1], ["AN", 3, 1, 6], ["FU", 1, [0, 1]], ["SP", 1, 0, 20, [1], 1], ["AN", 1, 1, 2], ["FFSP", 1, 0, [1, 0], 1, 1], ["AN", 1, 1, 6], ["PR", 4, 0, "auto_unroll_max_step$0"]]]], "r": [[0.0253882, 0.00381975, 0.00402299], 0, 12.4702, 1628775351], "v": "v0.6"}
{"i": [["[\"9847f8cc0b305137f49f2c5c0c8ab25d\", 1, 1280, 1000, 1280, 1000, 1, 1000]", "opencl -keys=opencl,gpu -max_num_threads=256 -thread_warp_size=1", [2, 16, 64, 4096, 4096000, 512, 2, 8], "llvm -keys=cpu -link-params=0 -mtriple=aarch64-linux-gnu", 0, []], [[], [["SP", 2, 0, 1, [1, 1, 1, 1], 1], ["SP", 2, 5, 1000, [5, 5, 1, 2], 1], ["SP", 2, 10, 1280, [4, 5], 1], ["RE", 2, [0, 5, 1, 6, 2, 7, 10, 11, 3, 8, 12, 4, 9]], ["FSP", 4, 0, 0, 3], ["FSP", 4, 4, 1, 3], ["RE", 4, [0, 4, 1, 5, 2, 6, 3, 7]], ["CA", 2, 4, 5], ["CHR", 1, "shared", [2]], ["CA", 2, 3, 6], ["CHR", 0, "shared", [3]], ["CA", 1, 4, 6], ["FU", 6, [0, 1]], ["AN", 6, 0, 5], ["FU", 6, [1, 2]], ["AN", 6, 1, 4], ["FU", 6, [2, 3]], ["AN", 6, 2, 6], ["FU", 3, [0, 1]], ["SP", 3, 0, 40, [2], 1], ["AN", 3, 1, 2], ["FFSP", 3, 0, [1, 0], 1, 1], ["AN", 3, 1, 6], ["FU", 1, [0, 1]], ["SP", 1, 0, 20, [1], 1], ["AN", 1, 1, 2], ["FFSP", 1, 0, [1, 0], 1, 1], ["AN", 1, 1, 6], ["PR", 4, 0, "auto_unroll_max_step$0"]]]], "r": [[0.0133167, 0.0104747, 0.0134009], 0, 7.09051, 1628775357], "v": "v0.6"}
{"i": [["[\"9847f8cc0b305137f49f2c5c0c8ab25d\", 1, 1280, 1000, 1280, 1000, 1, 1000]", "opencl -keys=opencl,gpu -max_num_threads=256 -thread_warp_size=1", [2, 16, 64, 4096, 4096000, 512, 2, 8], "llvm -keys=cpu -link-params=0 -mtriple=aarch64-linux-gnu", 0, []], [[], [["SP", 2, 0, 1, [1, 1, 1, 1], 1], ["SP", 2, 5, 1000, [1, 125, 2, 1], 1], ["SP", 2, 10, 1280, [2, 1], 1], ["RE", 2, [0, 5, 1, 6, 2, 7, 10, 11, 3, 8, 12, 4, 9]], ["FSP", 4, 0, 0, 3], ["FSP", 4, 4, 1, 3], ["RE", 4, [0, 4, 1, 5, 2, 6, 3, 7]], ["CA", 2, 4, 5], ["CHR", 1, "shared", [2]], ["CA", 2, 3, 6], ["CHR", 0, "shared", [3]], ["CA", 1, 4, 6], ["FU", 6, [0, 1]], ["AN", 6, 0, 5], ["FU", 6, [1, 2]], ["AN", 6, 1, 4], ["FU", 6, [2, 3]], ["AN", 6, 2, 6], ["FU", 3, [0, 1]], ["SP", 3, 0, 4, [4], 1], ["AN", 3, 1, 2], ["FFSP", 3, 0, [1, 0], 1, 1], ["AN", 3, 1, 6], ["FU", 1, [0, 1]], ["SP", 1, 0, 2, [1], 1], ["AN", 1, 1, 2], ["FFSP", 1, 0, [1, 0], 1, 1], ["AN", 1, 1, 6], ["PR", 4, 0, "auto_unroll_max_step$16"]]]], "r": [[0.0094037, 0.00928006, 0.0102074], 0, 7.38905, 1628775365], "v": "v0.6"}
{"i": [["[\"9847f8cc0b305137f49f2c5c0c8ab25d\", 1, 1280, 1000, 1280, 1000, 1, 1000]", "opencl -keys=opencl,gpu -max_num_threads=256 -thread_warp_size=1", [2, 16, 64, 4096, 4096000, 512, 2, 8], "llvm -keys=cpu -link-params=0 -mtriple=aarch64-linux-gnu", 0, []], [[], [["SP", 2, 0, 1, [1, 1, 1, 1], 1], ["SP", 2, 5, 1000, [1, 20, 2, 1], 1], ["SP", 2, 10, 1280, [1, 1], 1], ["RE", 2, [0, 5, 1, 6, 2, 7, 10, 11, 3, 8, 12, 4, 9]], ["FSP", 4, 0, 0, 3], ["FSP", 4, 4, 1, 3], ["RE", 4, [0, 4, 1, 5, 2, 6, 3, 7]], ["CA", 2, 4, 5], ["CHR", 1, "shared", [2]], ["CA", 2, 3, 6], ["CHR", 0, "shared", [3]], ["CA", 1, 4, 6], ["FU", 6, [0, 1]], ["AN", 6, 0, 5], ["FU", 6, [1, 2]], ["AN", 6, 1, 4], ["FU", 6, [2, 3]], ["AN", 6, 2, 6], ["FU", 3, [0, 1]], ["SP", 3, 0, 8, [1], 1], ["AN", 3, 1, 2], ["FFSP", 3, 0, [1, 0], 1, 1], ["AN", 3, 1, 6], ["FU", 1, [0, 1]], ["SP", 1, 0, 4, [2], 1], ["AN", 1, 1, 2], ["FFSP", 1, 0, [1, 0], 1, 1], ["AN", 1, 1, 6], ["PR", 4, 0, "auto_unroll_max_step$0"]]]], "r": [[0.0160212, 0.0170597, 0.0166126], 0, 6.60702, 1628775371], "v": "v0.6"}
{"i": [["[\"9847f8cc0b305137f49f2c5c0c8ab25d\", 1, 1280, 1000, 1280, 1000, 1, 1000]", "opencl -keys=opencl,gpu -max_num_threads=256 -thread_warp_size=1", [2, 16, 64, 4096, 4096000, 512, 2, 8], "llvm -keys=cpu -link-params=0 -mtriple=aarch64-linux-gnu", 0, []], [[], [["SP", 2, 0, 1, [1, 1, 1, 1], 1], ["SP", 2, 5, 1000, [2, 10, 5, 2], 1], ["SP", 2, 10, 1280, [2, 1], 1], ["RE", 2, [0, 5, 1, 6, 2, 7, 10, 11, 3, 8, 12, 4, 9]], ["FSP", 4, 0, 0, 3], ["FSP", 4, 4, 1, 3], ["RE", 4, [0, 4, 1, 5, 2, 6, 3, 7]], ["CA", 2, 4, 5], ["CHR", 1, "shared", [2]], ["CA", 2, 3, 6], ["CHR", 0, "shared", [3]], ["CA", 1, 4, 6], ["FU", 6, [0, 1]], ["AN", 6, 0, 5], ["FU", 6, [1, 2]], ["AN", 6, 1, 4], ["FU", 6, [2, 3]], ["AN", 6, 2, 6], ["FU", 3, [0, 1]], ["SP", 3, 0, 20, [2], 1], ["AN", 3, 1, 2], ["FFSP", 3, 0, [1, 0], 1, 1], ["AN", 3, 1, 6], ["FU", 1, [0, 1]], ["SP", 1, 0, 2, [1], 1], ["AN", 1, 1, 2], ["FFSP", 1, 0, [1, 0], 1, 1], ["AN", 1, 1, 6], ["PR", 4, 0, "auto_unroll_max_step$16"]]]], "r": [[0.0387367, 0.0109484, 0.0110306], 0, 7.631, 1628775377], "v": "v0.6"}
{"i": [["[\"9847f8cc0b305137f49f2c5c0c8ab25d\", 1, 1280, 1000, 1280, 1000, 1, 1000]", "opencl -keys=opencl,gpu -max_num_threads=256 -thread_warp_size=1", [2, 16, 64, 4096, 4096000, 512, 2, 8], "llvm -keys=cpu -link-params=0 -mtriple=aarch64-linux-gnu", 0, []], [[], [["SP", 2, 0, 1, [1, 1, 1, 1], 1], ["SP", 2, 5, 1000, [1, 1, 10, 2], 1], ["SP", 2, 10, 1280, [8, 5], 1], ["RE", 2, [0, 5, 1, 6, 2, 7, 10, 11, 3, 8, 12, 4, 9]], ["FSP", 4, 0, 0, 3], ["FSP", 4, 4, 1, 3], ["RE", 4, [0, 4, 1, 5, 2, 6, 3, 7]], ["CA", 2, 4, 5], ["CHR", 1, "shared", [2]], ["CA", 2, 3, 6], ["CHR", 0, "shared", [3]], ["CA", 1, 4, 6], ["FU", 6, [0, 1]], ["AN", 6, 0, 5], ["FU", 6, [1, 2]], ["AN", 6, 1, 4], ["FU", 6, [2, 3]], ["AN", 6, 2, 6], ["FU", 3, [0, 1]], ["SP", 3, 0, 80, [1], 1], ["AN", 3, 1, 2], ["FFSP", 3, 0, [1, 0], 1, 1], ["AN", 3, 1, 6], ["FU", 1, [0, 1]], ["SP", 1, 0, 40, [1], 1], ["AN", 1, 1, 2], ["FFSP", 1, 0, [1, 0], 1, 1], ["AN", 1, 1, 6], ["PR", 4, 0, "auto_unroll_max_step$0"]]]], "r": [[0.0677073, 0.0688876, 0.0669648], 0, 6.55364, 1628775383], "v": "v0.6"}
{"i": [["[\"9847f8cc0b305137f49f2c5c0c8ab25d\", 1, 1280, 1000, 1280, 1000, 1, 1000]", "opencl -keys=opencl,gpu -max_num_threads=256 -thread_warp_size=1", [2, 16, 64, 4096, 4096000, 512, 2, 8], "llvm -keys=cpu -link-params=0 -mtriple=aarch64-linux-gnu", 0, []], [[], [["SP", 2, 0, 1, [1, 1, 1, 1], 1], ["SP", 2, 5, 1000, [1, 5, 1, 40], 1], ["SP", 2, 10, 1280, [1, 1], 1], ["RE", 2, [0, 5, 1, 6, 2, 7, 10, 11, 3, 8, 12, 4, 9]], ["FSP", 4, 0, 0, 3], ["FSP", 4, 4, 1, 3], ["RE", 4, [0, 4, 1, 5, 2, 6, 3, 7]], ["CA", 2, 4, 5], ["CHR", 1, "shared", [2]], ["CA", 2, 3, 6], ["CHR", 0, "shared", [3]], ["CA", 1, 4, 6], ["FU", 6, [0, 1]], ["AN", 6, 0, 5], ["FU", 6, [1, 2]], ["AN", 6, 1, 4], ["FU", 6, [2, 3]], ["AN", 6, 2, 6], ["FU", 3, [0, 1]], ["SP", 3, 0, 100, [2], 1], ["AN", 3, 1, 2], ["FFSP", 3, 0, [1, 0], 1, 1], ["AN", 3, 1, 6], ["FU", 1, [0, 1]], ["SP", 1, 0, 5, [1], 1], ["AN", 1, 1, 2], ["FFSP", 1, 0, [1, 0], 1, 1], ["AN", 1, 1, 6], ["PR", 4, 0, "auto_unroll_max_step$16"]]]], "r": [[0.0478178, 0.0479572, 0.0506284], 0, 6.78293, 1628775390], "v": "v0.6"}
{"i": [["[\"9847f8cc0b305137f49f2c5c0c8ab25d\", 1, 1280, 1000, 1280, 1000, 1, 1000]", "opencl -keys=opencl,gpu -max_num_threads=256 -thread_warp_size=1", [2, 16, 64, 4096, 4096000, 512, 2, 8], "llvm -keys=cpu -link-params=0 -mtriple=aarch64-linux-gnu", 0, []], [[], [["SP", 2, 0, 1, [1, 1, 1, 1], 1], ["SP", 2, 5, 1000, [10, 4, 1, 1], 1], ["SP", 2, 10, 1280, [8, 2], 1], ["RE", 2, [0, 5, 1, 6, 2, 7, 10, 11, 3, 8, 12, 4, 9]], ["FSP", 4, 0, 0, 3], ["FSP", 4, 4, 1, 3], ["RE", 4, [0, 4, 1, 5, 2, 6, 3, 7]], ["CA", 2, 4, 5], ["CHR", 1, "shared", [2]], ["CA", 2, 3, 6], ["CHR", 0, "shared", [3]], ["CA", 1, 4, 6], ["FU", 6, [0, 1]], ["AN", 6, 0, 5], ["FU", 6, [1, 2]], ["AN", 6, 1, 4], ["FU", 6, [2, 3]], ["AN", 6, 2, 6], ["FU", 3, [0, 1]], ["SP", 3, 0, 16, [1], 1], ["AN", 3, 1, 2], ["FFSP", 3, 0, [1, 0], 1, 1], ["AN", 3, 1, 6], ["FU", 1, [0, 1]], ["SP", 1, 0, 16, [1], 1], ["AN", 1, 1, 2], ["FFSP", 1, 0, [1, 0], 1, 1], ["AN", 1, 1, 6], ["PR", 4, 0, "auto_unroll_max_step$16"]]]], "r": [[0.107901, 0.108143, 0.108218], 0, 7.86325, 1628775397], "v": "v0.6"}
{"i": [["[\"9847f8cc0b305137f49f2c5c0c8ab25d\", 1, 1280, 1000, 1280, 1000, 1, 1000]", "opencl -keys=opencl,gpu -max_num_threads=256 -thread_warp_size=1", [2, 16, 64, 4096, 4096000, 512, 2, 8], "llvm -keys=cpu -link-params=0 -mtriple=aarch64-linux-gnu", 0, []], [[], [["SP", 2, 0, 1, [1, 1, 1, 1], 1], ["SP", 2, 5, 1000, [1, 10, 1, 20], 1], ["SP", 2, 10, 1280, [1, 2], 1], ["RE", 2, [0, 5, 1, 6, 2, 7, 10, 11, 3, 8, 12, 4, 9]], ["FSP", 4, 0, 0, 3], ["FSP", 4, 4, 1, 3], ["RE", 4, [0, 4, 1, 5, 2, 6, 3, 7]], ["CA", 2, 4, 5], ["CHR", 1, "shared", [2]], ["CA", 2, 3, 6], ["CHR", 0, "shared", [3]], ["CA", 1, 4, 6], ["FU", 6, [0, 1]], ["AN", 6, 0, 5], ["FU", 6, [1, 2]], ["AN", 6, 1, 4], ["FU", 6, [2, 3]], ["AN", 6, 2, 6], ["FU", 3, [0, 1]], ["SP", 3, 0, 80, [1], 1], ["AN", 3, 1, 2], ["FFSP", 3, 0, [1, 0], 1, 1], ["AN", 3, 1, 6], ["FU", 1, [0, 1]], ["SP", 1, 0, 4, [4], 1], ["AN", 1, 1, 2], ["FFSP", 1, 0, [1, 0], 1, 1], ["AN", 1, 1, 6], ["PR", 4, 0, "auto_unroll_max_step$16"]]]], "r": [[0.0206849, 0.0190898, 0.0195066], 0, 6.03759, 1628775404], "v": "v0.6"}
{"i": [["[\"9847f8cc0b305137f49f2c5c0c8ab25d\", 1, 1280, 1000, 1280, 1000, 1, 1000]", "opencl -keys=opencl,gpu -max_num_threads=256 -thread_warp_size=1", [2, 16, 64, 4096, 4096000, 512, 2, 8], "llvm -keys=cpu -link-params=0 -mtriple=aarch64-linux-gnu", 0, []], [[], [["SP", 2, 0, 1, [1, 1, 1, 1], 1], ["SP", 2, 5, 1000, [2, 10, 1, 1], 1], ["SP", 2, 10, 1280, [1, 20], 1], ["RE", 2, [0, 5, 1, 6, 2, 7, 10, 11, 3, 8, 12, 4, 9]], ["FSP", 4, 0, 0, 3], ["FSP", 4, 4, 1, 3], ["RE", 4, [0, 4, 1, 5, 2, 6, 3, 7]], ["CA", 2, 4, 5], ["CHR", 1, "shared", [2]], ["CA", 2, 3, 6], ["CHR", 0, "shared", [3]], ["CA", 1, 4, 6], ["FU", 6, [0, 1]], ["AN", 6, 0, 5], ["FU", 6, [1, 2]], ["AN", 6, 1, 4], ["FU", 6, [2, 3]], ["AN", 6, 2, 6], ["FU", 3, [0, 1]], ["SP", 3, 0, 20, [1], 1], ["AN", 3, 1, 2], ["FFSP", 3, 0, [1, 0], 1, 1], ["AN", 3, 1, 6], ["FU", 1, [0, 1]], ["SP", 1, 0, 20, [1], 1], ["AN", 1, 1, 2], ["FFSP", 1, 0, [1, 0], 1, 1], ["AN", 1, 1, 6], ["PR", 4, 0, "auto_unroll_max_step$1024"]]]], "r": [[0.00484807, 0.00519235, 0.00501412], 0, 5.75933, 1628775410], "v": "v0.6"}
{"i": [["[\"9847f8cc0b305137f49f2c5c0c8ab25d\", 1, 1280, 1000, 1280, 1000, 1, 1000]", "opencl -keys=opencl,gpu -max_num_threads=256 -thread_warp_size=1", [2, 16, 64, 4096, 4096000, 512, 2, 8], "llvm -keys=cpu -link-params=0 -mtriple=aarch64-linux-gnu", 0, []], [[], [["SP", 2, 0, 1, [1, 1, 1, 1], 1], ["SP", 2, 5, 1000, [1, 10, 2, 2], 1], ["SP", 2, 10, 1280, [20, 1], 1], ["RE", 2, [0, 5, 1, 6, 2, 7, 10, 11, 3, 8, 12, 4, 9]], ["FSP", 4, 0, 0, 3], ["FSP", 4, 4, 1, 3], ["RE", 4, [0, 4, 1, 5, 2, 6, 3, 7]], ["CA", 2, 4, 5], ["CHR", 1, "shared", [2]], ["CA", 2, 3, 6], ["CHR", 0, "shared", [3]], ["CA", 1, 4, 6], ["FU", 6, [0, 1]], ["AN", 6, 0, 5], ["FU", 6, [1, 2]], ["AN", 6, 1, 4], ["FU", 6, [2, 3]], ["AN", 6, 2, 6], ["FU", 3, [0, 1]], ["SP", 3, 0, 80, [4], 1], ["AN", 3, 1, 2], ["FFSP", 3, 0, [1, 0], 1, 1], ["AN", 3, 1, 6], ["FU", 1, [0, 1]], ["SP", 1, 0, 20, [1], 1], ["AN", 1, 1, 2], ["FFSP", 1, 0, [1, 0], 1, 1], ["AN", 1, 1, 6], ["PR", 4, 0, "auto_unroll_max_step$512"]]]], "r": [[0.015281, 0.00284043, 0.00280083], 0, 6.62237, 1628775416], "v": "v0.6"}
{"i": [["[\"9847f8cc0b305137f49f2c5c0c8ab25d\", 1, 1280, 1000, 1280, 1000, 1, 1000]", "opencl -keys=opencl,gpu -max_num_threads=256 -thread_warp_size=1", [2, 16, 64, 4096, 4096000, 512, 2, 8], "llvm -keys=cpu -link-params=0 -mtriple=aarch64-linux-gnu", 0, []], [[], [["SP", 2, 0, 1, [1, 1, 1, 1], 1], ["SP", 2, 5, 1000, [1, 10, 2, 1], 1], ["SP", 2, 10, 1280, [4, 2], 1], ["RE", 2, [0, 5, 1, 6, 2, 7, 10, 11, 3, 8, 12, 4, 9]], ["FSP", 4, 0, 0, 3], ["FSP", 4, 4, 1, 3], ["RE", 4, [0, 4, 1, 5, 2, 6, 3, 7]], ["CA", 2, 4, 5], ["CHR", 1, "shared", [2]], ["CA", 2, 3, 6], ["CHR", 0, "shared", [3]], ["CA", 1, 4, 6], ["FU", 6, [0, 1]], ["AN", 6, 0, 5], ["FU", 6, [1, 2]], ["AN", 6, 1, 4], ["FU", 6, [2, 3]], ["AN", 6, 2, 6], ["FU", 3, [0, 1]], ["SP", 3, 0, 8, [1], 1], ["AN", 3, 1, 2], ["FFSP", 3, 0, [1, 0], 1, 1], ["AN", 3, 1, 6], ["FU", 1, [0, 1]], ["SP", 1, 0, 8, [1], 1], ["AN", 1, 1, 2], ["FFSP", 1, 0, [1, 0], 1, 1], ["AN", 1, 1, 6], ["PR", 4, 0, "auto_unroll_max_step$64"]]]], "r": [[0.00479223, 0.00491007, 0.00505723], 0, 38.7303, 1628775455], "v": "v0.6"}
{"i": [["[\"9847f8cc0b305137f49f2c5c0c8ab25d\", 1, 1280, 1000, 1280, 1000, 1, 1000]", "opencl -keys=opencl,gpu -max_num_threads=256 -thread_warp_size=1", [2, 16, 64, 4096, 4096000, 512, 2, 8], "llvm -keys=cpu -link-params=0 -mtriple=aarch64-linux-gnu", 0, []], [[], [["SP", 2, 0, 1, [1, 1, 1, 1], 1], ["SP", 2, 5, 1000, [1, 10, 1, 1], 1], ["SP", 2, 10, 1280, [16, 2], 1], ["RE", 2, [0, 5, 1, 6, 2, 7, 10, 11, 3, 8, 12, 4, 9]], ["FSP", 4, 0, 0, 3], ["FSP", 4, 4, 1, 3], ["RE", 4, [0, 4, 1, 5, 2, 6, 3, 7]], ["CA", 2, 4, 5], ["CHR", 1, "shared", [2]], ["CA", 2, 3, 6], ["CHR", 0, "shared", [3]], ["CA", 1, 4, 6], ["FU", 6, [0, 1]], ["AN", 6, 0, 5], ["FU", 6, [1, 2]], ["AN", 6, 1, 4], ["FU", 6, [2, 3]], ["AN", 6, 2, 6], ["FU", 3, [0, 1]], ["SP", 3, 0, 64, [64], 1], ["AN", 3, 1, 2], ["FFSP", 3, 0, [1, 0], 1, 1], ["AN", 3, 1, 6], ["FU", 1, [0, 1]], ["SP", 1, 0, 64, [1], 1], ["AN", 1, 1, 2], ["FFSP", 1, 0, [1, 0], 1, 1], ["AN", 1, 1, 6], ["PR", 4, 0, "auto_unroll_max_step$0"]]]], "r": [[0.0101602, 0.0101164, 0.0106437], 0, 5.07438, 1628775459], "v": "v0.6"}
{"i": [["[\"9847f8cc0b305137f49f2c5c0c8ab25d\", 1, 1280, 1000, 1280, 1000, 1, 1000]", "opencl -keys=opencl,gpu -max_num_threads=256 -thread_warp_size=1", [2, 16, 64, 4096, 4096000, 512, 2, 8], "llvm -keys=cpu -link-params=0 -mtriple=aarch64-linux-gnu", 0, []], [[], [["SP", 2, 0, 1, [1, 1, 1, 1], 1], ["SP", 2, 5, 1000, [1, 20, 2, 1], 1], ["SP", 2, 10, 1280, [4, 1], 1], ["RE", 2, [0, 5, 1, 6, 2, 7, 10, 11, 3, 8, 12, 4, 9]], ["FSP", 4, 0, 0, 3], ["FSP", 4, 4, 1, 3], ["RE", 4, [0, 4, 1, 5, 2, 6, 3, 7]], ["CA", 2, 4, 5], ["CHR", 1, "shared", [2]], ["CA", 2, 3, 6], ["CHR", 0, "shared", [3]], ["CA", 1, 4, 6], ["FU", 6, [0, 1]], ["AN", 6, 0, 5], ["FU", 6, [1, 2]], ["AN", 6, 1, 4], ["FU", 6, [2, 3]], ["AN", 6, 2, 6], ["FU", 3, [0, 1]], ["SP", 3, 0, 4, [1], 1], ["AN", 3, 1, 2], ["FFSP", 3, 0, [1, 0], 1, 1], ["AN", 3, 1, 6], ["FU", 1, [0, 1]], ["SP", 1, 0, 4, [1], 1], ["AN", 1, 1, 2], ["FFSP", 1, 0, [1, 0], 1, 1], ["AN", 1, 1, 6], ["PR", 4, 0, "auto_unroll_max_step$64"]]]], "r": [[0.0274167, 0.0275509, 0.0299128], 0, 6.78638, 1628775466], "v": "v0.6"}
{"i": [["[\"9847f8cc0b305137f49f2c5c0c8ab25d\", 1, 1280, 1000, 1280, 1000, 1, 1000]", "opencl -keys=opencl,gpu -max_num_threads=256 -thread_warp_size=1", [2, 16, 64, 4096, 4096000, 512, 2, 8], "llvm -keys=cpu -link-params=0 -mtriple=aarch64-linux-gnu", 0, []], [[], [["SP", 2, 0, 1, [1, 1, 1, 1], 1], ["SP", 2, 5, 1000, [1, 10, 2, 2], 1], ["SP", 2, 10, 1280, [2, 10], 1], ["RE", 2, [0, 5, 1, 6, 2, 7, 10, 11, 3, 8, 12, 4, 9]], ["FSP", 4, 0, 0, 3], ["FSP", 4, 4, 1, 3], ["RE", 4, [0, 4, 1, 5, 2, 6, 3, 7]], ["CA", 2, 4, 5], ["CHR", 1, "shared", [2]], ["CA", 2, 3, 6], ["CHR", 0, "shared", [3]], ["CA", 1, 4, 6], ["FU", 6, [0, 1]], ["AN", 6, 0, 5], ["FU", 6, [1, 2]], ["AN", 6, 1, 4], ["FU", 6, [2, 3]], ["AN", 6, 2, 6], ["FU", 3, [0, 1]], ["SP", 3, 0, 80, [1], 1], ["AN", 3, 1, 2], ["FFSP", 3, 0, [1, 0], 1, 1], ["AN", 3, 1, 6], ["FU", 1, [0, 1]], ["SP", 1, 0, 20, [4], 1], ["AN", 1, 1, 2], ["FFSP", 1, 0, [1, 0], 1, 1], ["AN", 1, 1, 6], ["PR", 4, 0, "auto_unroll_max_step$512"]]]], "r": [[0.0390649, 0.0390818, 0.0390862], 0, 9.01672, 1628775477], "v": "v0.6"}
{"i": [["[\"9847f8cc0b305137f49f2c5c0c8ab25d\", 1, 1280, 1000, 1280, 1000, 1, 1000]", "opencl -keys=opencl,gpu -max_num_threads=256 -thread_warp_size=1", [2, 16, 64, 4096, 4096000, 512, 2, 8], "llvm -keys=cpu -link-params=0 -mtriple=aarch64-linux-gnu", 0, []], [[], [["SP", 2, 0, 1, [1, 1, 1, 1], 1], ["SP", 2, 5, 1000, [2, 10, 1, 1], 1], ["SP", 2, 10, 1280, [5, 4], 1], ["RE", 2, [0, 5, 1, 6, 2, 7, 10, 11, 3, 8, 12, 4, 9]], ["FSP", 4, 0, 0, 3], ["FSP", 4, 4, 1, 3], ["RE", 4, [0, 4, 1, 5, 2, 6, 3, 7]], ["CA", 2, 4, 5], ["CHR", 1, "shared", [2]], ["CA", 2, 3, 6], ["CHR", 0, "shared", [3]], ["CA", 1, 4, 6], ["FU", 6, [0, 1]], ["AN", 6, 0, 5], ["FU", 6, [1, 2]], ["AN", 6, 1, 4], ["FU", 6, [2, 3]], ["AN", 6, 2, 6], ["FU", 3, [0, 1]], ["SP", 3, 0, 20, [1], 1], ["AN", 3, 1, 2], ["FFSP", 3, 0, [1, 0], 1, 1], ["AN", 3, 1, 6], ["FU", 1, [0, 1]], ["SP", 1, 0, 20, [1], 1], ["AN", 1, 1, 2], ["FFSP", 1, 0, [1, 0], 1, 1], ["AN", 1, 1, 6], ["PR", 4, 0, "auto_unroll_max_step$1024"]]]], "r": [[0.0053552, 0.00475292, 0.00503764], 0, 7.96801, 1628775485], "v": "v0.6"}
{"i": [["[\"9847f8cc0b305137f49f2c5c0c8ab25d\", 1, 1280, 1000, 1280, 1000, 1, 1000]", "opencl -keys=opencl,gpu -max_num_threads=256 -thread_warp_size=1", [2, 16, 64, 4096, 4096000, 512, 2, 8], "llvm -keys=cpu -link-params=0 -mtriple=aarch64-linux-gnu", 0, []], [[], [["SP", 2, 0, 1, [1, 1, 1, 1], 1], ["SP", 2, 5, 1000, [1, 10, 1, 1], 1], ["SP", 2, 10, 1280, [2, 10], 1], ["RE", 2, [0, 5, 1, 6, 2, 7, 10, 11, 3, 8, 12, 4, 9]], ["FSP", 4, 0, 0, 3], ["FSP", 4, 4, 1, 3], ["RE", 4, [0, 4, 1, 5, 2, 6, 3, 7]], ["CA", 2, 4, 5], ["CHR", 1, "shared", [2]], ["CA", 2, 3, 6], ["CHR", 0, "shared", [3]], ["CA", 1, 4, 6], ["FU", 6, [0, 1]], ["AN", 6, 0, 5], ["FU", 6, [1, 2]], ["AN", 6, 1, 4], ["FU", 6, [2, 3]], ["AN", 6, 2, 6], ["FU", 3, [0, 1]], ["SP", 3, 0, 16, [1], 1], ["AN", 3, 1, 2], ["FFSP", 3, 0, [1, 0], 1, 1], ["AN", 3, 1, 6], ["FU", 1, [0, 1]], ["SP", 1, 0, 16, [1], 1], ["AN", 1, 1, 2], ["FFSP", 1, 0, [1, 0], 1, 1], ["AN", 1, 1, 6], ["PR", 4, 0, "auto_unroll_max_step$512"]]]], "r": [[0.028967, 0.0295301, 0.0302516], 0, 12.7229, 1628775497], "v": "v0.6"}
{"i": [["[\"9847f8cc0b305137f49f2c5c0c8ab25d\", 1, 1280, 1000, 1280, 1000, 1, 1000]", "opencl -keys=opencl,gpu -max_num_threads=256 -thread_warp_size=1", [2, 16, 64, 4096, 4096000, 512, 2, 8], "llvm -keys=cpu -link-params=0 -mtriple=aarch64-linux-gnu", 0, []], [[], [["SP", 2, 0, 1, [1, 1, 1, 1], 1], ["SP", 2, 5, 1000, [1, 20, 1, 1], 1], ["SP", 2, 10, 1280, [2, 20], 1], ["RE", 2, [0, 5, 1, 6, 2, 7, 10, 11, 3, 8, 12, 4, 9]], ["FSP", 4, 0, 0, 3], ["FSP", 4, 4, 1, 3], ["RE", 4, [0, 4, 1, 5, 2, 6, 3, 7]], ["CA", 2, 4, 5], ["CHR", 1, "shared", [2]], ["CA", 2, 3, 6], ["CHR", 0, "shared", [3]], ["CA", 1, 4, 6], ["FU", 6, [0, 1]], ["AN", 6, 0, 5], ["FU", 6, [1, 2]], ["AN", 6, 1, 4], ["FU", 6, [2, 3]], ["AN", 6, 2, 6], ["FU", 3, [0, 1]], ["SP", 3, 0, 20, [1], 1], ["AN", 3, 1, 2], ["FFSP", 3, 0, [1, 0], 1, 1], ["AN", 3, 1, 6], ["FU", 1, [0, 1]], ["SP", 1, 0, 10, [10], 1], ["AN", 1, 1, 2], ["FFSP", 1, 0, [1, 0], 1, 1], ["AN", 1, 1, 6], ["PR", 4, 0, "auto_unroll_max_step$1024"]]]], "r": [[0.00414147, 0.00423939, 0.00445008], 0, 9.49537, 1628775505], "v": "v0.6"}
{"i": [["[\"9847f8cc0b305137f49f2c5c0c8ab25d\", 1, 1280, 1000, 1280, 1000, 1, 1000]", "opencl -keys=opencl,gpu -max_num_threads=256 -thread_warp_size=1", [2, 16, 64, 4096, 4096000, 512, 2, 8], "llvm -keys=cpu -link-params=0 -mtriple=aarch64-linux-gnu", 0, []], [[], [["SP", 2, 0, 1, [1, 1, 1, 1], 1], ["SP", 2, 5, 1000, [1, 10, 1, 10], 1], ["SP", 2, 10, 1280, [8, 1], 1], ["RE", 2, [0, 5, 1, 6, 2, 7, 10, 11, 3, 8, 12, 4, 9]], ["FSP", 4, 0, 0, 3], ["FSP", 4, 4, 1, 3], ["RE", 4, [0, 4, 1, 5, 2, 6, 3, 7]], ["CA", 2, 4, 5], ["CHR", 1, "shared", [2]], ["CA", 2, 3, 6], ["CHR", 0, "shared", [3]], ["CA", 1, 4, 6], ["FU", 6, [0, 1]], ["AN", 6, 0, 5], ["FU", 6, [1, 2]], ["AN", 6, 1, 4], ["FU", 6, [2, 3]], ["AN", 6, 2, 6], ["FU", 3, [0, 1]], ["SP", 3, 0, 80, [4], 1], ["AN", 3, 1, 2], ["FFSP", 3, 0, [1, 0], 1, 1], ["AN", 3, 1, 6], ["FU", 1, [0, 1]], ["SP", 1, 0, 40, [1], 1], ["AN", 1, 1, 2], ["FFSP", 1, 0, [1, 0], 1, 1], ["AN", 1, 1, 6], ["PR", 4, 0, "auto_unroll_max_step$512"]]]], "r": [[0.0111837, 0.00303005, 0.00298711], 0, 12.0903, 1628775516], "v": "v0.6"}
{"i": [["[\"9847f8cc0b305137f49f2c5c0c8ab25d\", 1, 1280, 1000, 1280, 1000, 1, 1000]", "opencl -keys=opencl,gpu -max_num_threads=256 -thread_warp_size=1", [2, 16, 64, 4096, 4096000, 512, 2, 8], "llvm -keys=cpu -link-params=0 -mtriple=aarch64-linux-gnu", 0, []], [[], [["SP", 2, 0, 1, [1, 1, 1, 1], 1], ["SP", 2, 5, 1000, [1, 50, 1, 4], 1], ["SP", 2, 10, 1280, [1, 4], 1], ["RE", 2, [0, 5, 1, 6, 2, 7, 10, 11, 3, 8, 12, 4, 9]], ["FSP", 4, 0, 0, 3], ["FSP", 4, 4, 1, 3], ["RE", 4, [0, 4, 1, 5, 2, 6, 3, 7]], ["CA", 2, 4, 5], ["CHR", 1, "shared", [2]], ["CA", 2, 3, 6], ["CHR", 0, "shared", [3]], ["CA", 1, 4, 6], ["FU", 6, [0, 1]], ["AN", 6, 0, 5], ["FU", 6, [1, 2]], ["AN", 6, 1, 4], ["FU", 6, [2, 3]], ["AN", 6, 2, 6], ["FU", 3, [0, 1]], ["SP", 3, 0, 8, [1], 1], ["AN", 3, 1, 2], ["FFSP", 3, 0, [1, 0], 1, 1], ["AN", 3, 1, 6], ["FU", 1, [0, 1]], ["SP", 1, 0, 4, [1], 1], ["AN", 1, 1, 2], ["FFSP", 1, 0, [1, 0], 1, 1], ["AN", 1, 1, 6], ["PR", 4, 0, "auto_unroll_max_step$1024"]]]], "r": [[0.0289515, 0.0309017, 0.0305662], 0, 9.48047, 1628775524], "v": "v0.6"}
{"i": [["[\"9847f8cc0b305137f49f2c5c0c8ab25d\", 1, 1280, 1000, 1280, 1000, 1, 1000]", "opencl -keys=opencl,gpu -max_num_threads=256 -thread_warp_size=1", [2, 16, 64, 4096, 4096000, 512, 2, 8], "llvm -keys=cpu -link-params=0 -mtriple=aarch64-linux-gnu", 0, []], [[], [["SP", 2, 0, 1, [1, 1, 1, 1], 1], ["SP", 2, 5, 1000, [1, 20, 1, 1], 1], ["SP", 2, 10, 1280, [1, 8], 1], ["RE", 2, [0, 5, 1, 6, 2, 7, 10, 11, 3, 8, 12, 4, 9]], ["FSP", 4, 0, 0, 3], ["FSP", 4, 4, 1, 3], ["RE", 4, [0, 4, 1, 5, 2, 6, 3, 7]], ["CA", 2, 4, 5], ["CHR", 1, "shared", [2]], ["CA", 2, 3, 6], ["CHR", 0, "shared", [3]], ["CA", 1, 4, 6], ["FU", 6, [0, 1]], ["AN", 6, 0, 5], ["FU", 6, [1, 2]], ["AN", 6, 1, 4], ["FU", 6, [2, 3]], ["AN", 6, 2, 6], ["FU", 3, [0, 1]], ["SP", 3, 0, 8, [2], 1], ["AN", 3, 1, 2], ["FFSP", 3, 0, [1, 0], 1, 1], ["AN", 3, 1, 6], ["FU", 1, [0, 1]], ["SP", 1, 0, 8, [1], 1], ["AN", 1, 1, 2], ["FFSP", 1, 0, [1, 0], 1, 1], ["AN", 1, 1, 6], ["PR", 4, 0, "auto_unroll_max_step$16"]]]], "r": [[0.0148879, 0.00251999, 0.00269509], 0, 7.60113, 1628775534], "v": "v0.6"}
{"i": [["[\"9847f8cc0b305137f49f2c5c0c8ab25d\", 1, 1280, 1000, 1280, 1000, 1, 1000]", "opencl -keys=opencl,gpu -max_num_threads=256 -thread_warp_size=1", [2, 16, 64, 4096, 4096000, 512, 2, 8], "llvm -keys=cpu -link-params=0 -mtriple=aarch64-linux-gnu", 0, []], [[], [["SP", 2, 0, 1, [1, 1, 1, 1], 1], ["SP", 2, 5, 1000, [1, 100, 2, 1], 1], ["SP", 2, 10, 1280, [2, 1], 1], ["RE", 2, [0, 5, 1, 6, 2, 7, 10, 11, 3, 8, 12, 4, 9]], ["FSP", 4, 0, 0, 3], ["FSP", 4, 4, 1, 3], ["RE", 4, [0, 4, 1, 5, 2, 6, 3, 7]], ["CA", 2, 4, 5], ["CHR", 1, "shared", [2]], ["CA", 2, 3, 6], ["CHR", 0, "shared", [3]], ["CA", 1, 4, 6], ["FU", 6, [0, 1]], ["AN", 6, 0, 5], ["FU", 6, [1, 2]], ["AN", 6, 1, 4], ["FU", 6, [2, 3]], ["AN", 6, 2, 6], ["FU", 3, [0, 1]], ["SP", 3, 0, 4, [1], 1], ["AN", 3, 1, 2], ["FFSP", 3, 0, [1, 0], 1, 1], ["AN", 3, 1, 6], ["FU", 1, [0, 1]], ["SP", 1, 0, 2, [1], 1], ["AN", 1, 1, 2], ["FFSP", 1, 0, [1, 0], 1, 1], ["AN", 1, 1, 6], ["PR", 4, 0, "auto_unroll_max_step$16"]]]], "r": [[0.00573726, 0.00595243, 0.0060713], 0, 11.309, 1628775545], "v": "v0.6"}
{"i": [["[\"9847f8cc0b305137f49f2c5c0c8ab25d\", 1, 1280, 1000, 1280, 1000, 1, 1000]", "opencl -keys=opencl,gpu -max_num_threads=256 -thread_warp_size=1", [2, 16, 64, 4096, 4096000, 512, 2, 8], "llvm -keys=cpu -link-params=0 -mtriple=aarch64-linux-gnu", 0, []], [[], [["SP", 2, 0, 1, [1, 1, 1, 1], 1], ["SP", 2, 5, 1000, [1, 50, 1, 1], 1], ["SP", 2, 10, 1280, [8, 1], 1], ["RE", 2, [0, 5, 1, 6, 2, 7, 10, 11, 3, 8, 12, 4, 9]], ["FSP", 4, 0, 0, 3], ["FSP", 4, 4, 1, 3], ["RE", 4, [0, 4, 1, 5, 2, 6, 3, 7]], ["CA", 2, 4, 5], ["CHR", 1, "shared", [2]], ["CA", 2, 3, 6], ["CHR", 0, "shared", [3]], ["CA", 1, 4, 6], ["FU", 6, [0, 1]], ["AN", 6, 0, 5], ["FU", 6, [1, 2]], ["AN", 6, 1, 4], ["FU", 6, [2, 3]], ["AN", 6, 2, 6], ["FU", 3, [0, 1]], ["SP", 3, 0, 32, [1], 1], ["AN", 3, 1, 2], ["FFSP", 3, 0, [1, 0], 1, 1], ["AN", 3, 1, 6], ["FU", 1, [0, 1]], ["SP", 1, 0, 16, [2], 1], ["AN", 1, 1, 2], ["FFSP", 1, 0, [1, 0], 1, 1], ["AN", 1, 1, 6], ["PR", 4, 0, "auto_unroll_max_step$64"]]]], "r": [[0.00382358, 0.00401095, 0.00397659], 0, 10.5762, 1628775555], "v": "v0.6"}
{"i": [["[\"9847f8cc0b305137f49f2c5c0c8ab25d\", 1, 1280, 1000, 1280, 1000, 1, 1000]", "opencl -keys=opencl,gpu -max_num_threads=256 -thread_warp_size=1", [2, 16, 64, 4096, 4096000, 512, 2, 8], "llvm -keys=cpu -link-params=0 -mtriple=aarch64-linux-gnu", 0, []], [[], [["SP", 2, 0, 1, [1, 1, 1, 1], 1], ["SP", 2, 5, 1000, [1, 10, 1, 20], 1], ["SP", 2, 10, 1280, [2, 2], 1], ["RE", 2, [0, 5, 1, 6, 2, 7, 10, 11, 3, 8, 12, 4, 9]], ["FSP", 4, 0, 0, 3], ["FSP", 4, 4, 1, 3], ["RE", 4, [0, 4, 1, 5, 2, 6, 3, 7]], ["CA", 2, 4, 5], ["CHR", 1, "shared", [2]], ["CA", 2, 3, 6], ["CHR", 0, "shared", [3]], ["CA", 1, 4, 6], ["FU", 6, [0, 1]], ["AN", 6, 0, 5], ["FU", 6, [1, 2]], ["AN", 6, 1, 4], ["FU", 6, [2, 3]], ["AN", 6, 2, 6], ["FU", 3, [0, 1]], ["SP", 3, 0, 80, [1], 1], ["AN", 3, 1, 2], ["FFSP", 3, 0, [1, 0], 1, 1], ["AN", 3, 1, 6], ["FU", 1, [0, 1]], ["SP", 1, 0, 4, [2], 1], ["AN", 1, 1, 2], ["FFSP", 1, 0, [1, 0], 1, 1], ["AN", 1, 1, 6], ["PR", 4, 0, "auto_unroll_max_step$16"]]]], "r": [[0.0147683, 0.0149241, 0.0148731], 0, 9.28328, 1628775563], "v": "v0.6"}
{"i": [["[\"9847f8cc0b305137f49f2c5c0c8ab25d\", 1, 1280, 1000, 1280, 1000, 1, 1000]", "opencl -keys=opencl,gpu -max_num_threads=256 -thread_warp_size=1", [2, 16, 64, 4096, 4096000, 512, 2, 8], "llvm -keys=cpu -link-params=0 -mtriple=aarch64-linux-gnu", 0, []], [[], [["SP", 2, 0, 1, [1, 1, 1, 1], 1], ["SP", 2, 5, 1000, [1, 10, 1, 2], 1], ["SP", 2, 10, 1280, [10, 1], 1], ["RE", 2, [0, 5, 1, 6, 2, 7, 10, 11, 3, 8, 12, 4, 9]], ["FSP", 4, 0, 0, 3], ["FSP", 4, 4, 1, 3], ["RE", 4, [0, 4, 1, 5, 2, 6, 3, 7]], ["CA", 2, 4, 5], ["CHR", 1, "shared", [2]], ["CA", 2, 3, 6], ["CHR", 0, "shared", [3]], ["CA", 1, 4, 6], ["FU", 6, [0, 1]], ["AN", 6, 0, 5], ["FU", 6, [1, 2]], ["AN", 6, 1, 4], ["FU", 6, [2, 3]], ["AN", 6, 2, 6], ["FU", 3, [0, 1]], ["SP", 3, 0, 4, [1], 1], ["AN", 3, 1, 2], ["FFSP", 3, 0, [1, 0], 1, 1], ["AN", 3, 1, 6], ["FU", 1, [0, 1]], ["SP", 1, 0, 2, [2], 1], ["AN", 1, 1, 2], ["FFSP", 1, 0, [1, 0], 1, 1], ["AN", 1, 1, 6], ["PR", 4, 0, "auto_unroll_max_step$64"]]]], "r": [[0.00384202, 0.00395066, 0.00400937], 0, 8.44961, 1628775570], "v": "v0.6"}
{"i": [["[\"9847f8cc0b305137f49f2c5c0c8ab25d\", 1, 1280, 1000, 1280, 1000, 1, 1000]", "opencl -keys=opencl,gpu -max_num_threads=256 -thread_warp_size=1", [2, 16, 64, 4096, 4096000, 512, 2, 8], "llvm -keys=cpu -link-params=0 -mtriple=aarch64-linux-gnu", 0, []], [[], [["SP", 2, 0, 1, [1, 1, 1, 1], 1], ["SP", 2, 5, 1000, [1, 10, 1, 2], 1], ["SP", 2, 10, 1280, [8, 5], 1], ["RE", 2, [0, 5, 1, 6, 2, 7, 10, 11, 3, 8, 12, 4, 9]], ["FSP", 4, 0, 0, 3], ["FSP", 4, 4, 1, 3], ["RE", 4, [0, 4, 1, 5, 2, 6, 3, 7]], ["CA", 2, 4, 5], ["CHR", 1, "shared", [2]], ["CA", 2, 3, 6], ["CHR", 0, "shared", [3]], ["CA", 1, 4, 6], ["FU", 6, [0, 1]], ["AN", 6, 0, 5], ["FU", 6, [1, 2]], ["AN", 6, 1, 4], ["FU", 6, [2, 3]], ["AN", 6, 2, 6], ["FU", 3, [0, 1]], ["SP", 3, 0, 80, [1], 1], ["AN", 3, 1, 2], ["FFSP", 3, 0, [1, 0], 1, 1], ["AN", 3, 1, 6], ["FU", 1, [0, 1]], ["SP", 1, 0, 40, [10], 1], ["AN", 1, 1, 2], ["FFSP", 1, 0, [1, 0], 1, 1], ["AN", 1, 1, 6], ["PR", 4, 0, "auto_unroll_max_step$0"]]]], "r": [[0.0565637, 0.00966618, 0.00980036], 0, 7.52235, 1628775576], "v": "v0.6"}
